title,description,published date,url,publisher_title,publisher_href
CEOs das maiores empresas abertas ganham até R$ 68 milhões por ano; veja lista - Folha de S.Paulo,CEOs das maiores empresas abertas ganham até R$ 68 milhões por ano; veja lista  Folha de S.Paulo,"Tue, 02 Jul 2024 07:00:00 GMT",https://news.google.com/rss/articles/CBMixwFBVV95cUxOUVY2NkNmOGtwZVhsc2V6c29nRkMzSU1lOU9QYy1BRlpPY3hPYUpCNjNxYnFxNVBJc0F3TU5mTXhncEFhY3FpZTNWU3VjVXR3V0JJeVRyVk1VX3VEOFBJZlNfYmFOazBZbzJvcWZ2TUtsTENrcFhNb2p3U0ptVjFHWUZOYmJ1Z3B1QWhSU1l5cmVfM1BqQy1Cb1hHVVJvSUxKSVVnQVdLZTFhT2luV3dCWFJsYXNpZlpKWFRxSWt4bTBQWE43cUhZ0gHMAUFVX3lxTE1fVDlYclU5d2FmWFl1TFBLTFBFUTI5UmRRZkkwMlYyVUJGUm9uLURBQ1BUa0xWa3Q5amk3S2Z1OVdoNnp6Y2F2N3NuSjFZdzU2RWd2NmllMFRGdEkwME5Vb2tnbEJRX0o5WDVFRndFSnFSNEdrMEUydndfY2FUald1R3JLcVlwcmRLTTdrRElRc2hib2dxdXVMN29CRThyZ216eElzS2Fyb0dpVWNjNVBtTFlRUV9lS3ZiNGFFT3ZUZllVN1Y0RnN3UV9NOA?oc=5&hl=en-US&gl=US&ceid=US:en,Folha de S.Paulo,https://www1.folha.uol.com.br
Bradesco contrata Karolyna Schenk como diretora gerente da área de banco de investimento do Bradesco BBI - ADVFN,Bradesco contrata Karolyna Schenk como diretora gerente da área de banco de investimento do Bradesco BBI  ADVFN,"Mon, 15 Jul 2024 07:00:00 GMT",https://news.google.com/rss/articles/CBMi1wFBVV95cUxOQmhpR1N0SmNPdWtQWjh0TU41dy1yNWE2Y3pFWVpHTnR3OEg4bnRMYUpYSDdINWZvenVpQzA4SERSVm8xa01XRHBHWHlCbS1uZUZ2RVJwWUpEX1R4bG1KdGVHMFJFdXU4RVFVbVlKMHJBdHFaWWk3bG5rdlVTUXpqRmttbEVWSUlxUldmT2lBcXBJbU15M1Y2eFRYbE8zSUtTVGxnWGh3am5VclFLVzhKNzhHZnBhYWotcVRQTE10bU1jSGZhX1h3Mk9vTU5DeHJhckZQNEFnOA?oc=5&hl=en-US&gl=US&ceid=US:en,ADVFN,https://br.advfn.com
Prio (PRIO3) enfrenta paralisação de poços e atrasos; veja análise e recomendação - Estadão E-Investidor,Prio (PRIO3) enfrenta paralisação de poços e atrasos; veja análise e recomendação  Estadão E-Investidor,"Fri, 05 Jul 2024 07:00:00 GMT",https://news.google.com/rss/articles/CBMimAFBVV95cUxPclZUWDJaMW5Za0s5UHo2cVdBa3RfazVpcEVRY0R3VWJqcXVqUWgtQXpGTTlFWEp3QlgyeE5tSmFqcEkxdTFoNzRyQUpPbWl0ZmZoUERxLU4wUFUwVnBUbGdhMU1PVnc3QW55VXhoVnJfRjFFc1c3d2Fsa2xrY01PRWQ5YVdsRklfemhGVDI4b1NtRGFrMEJYYg?oc=5&hl=en-US&gl=US&ceid=US:en,Estadão E-Investidor,https://einvestidor.estadao.com.br
As ações da B3 que estão no radar do mercado após pior semestre do Ibovespa em 4 anos - InfoMoney,As ações da B3 que estão no radar do mercado após pior semestre do Ibovespa em 4 anos  InfoMoney,"Mon, 01 Jul 2024 07:00:00 GMT",https://news.google.com/rss/articles/CBMiwgFBVV95cUxNU3JOZGJfbkxNTm1iVG5qa2FMdXF3em11RDFOeUpfejBjTnFIbVJtRmNTcVFybncteTVzZEpiY01oQ2lZWHhfMjVBdmZtTEtEeEd6VDJ2alN0RHI2djljVV9PcXN2MnBFdmJFR3V1bV95VEZ5UUJnRzQzeTh6ZlBCTjB1Q2hvbF82VHp2Q25Vd1ltcXN5UVRMSEFWYy1xalpDUUxHeGNMVFdtSXpNSDBTQk1ORUhsQkpnbDFjbUZnS2d3UdIBxwFBVV95cUxPOGZpczVDbXBGUmlrdGJqWXBNdDhmUndkaXV2dU5uOURlNXo3RDI0eTJUeFdoNUx3XzlnWkR6S0tGWnRrZnE0ZlVTdVNYS3p6ZVA2TjEwZzZldlNSdEJUTGhSdll3dXNqd2EzbWstajh6M3RoNm5DWmI2MTBXbUtQbDN1ZHNNVm1Hc3JqSUJ0WjdjU2w0WTY5YV9laXh6MTNCZzBzT2hZY05HcmlacFRLdFFCTnhZdzFfOW1WT3gyY1FYWW1JZHM4?oc=5&hl=en-US&gl=US&ceid=US:en,InfoMoney,https://www.infomoney.com.br
"Tchau, Suzano (SUZB3): As 10 small caps que a Terra selecionou para lucrar no mês de julho - Money Times","Tchau, Suzano (SUZB3): As 10 small caps que a Terra selecionou para lucrar no mês de julho  Money Times","Thu, 04 Jul 2024 07:00:00 GMT",https://news.google.com/rss/articles/CBMivwFBVV95cUxQek9heWlIUHFsUmczb2d6emhIY3A4UnEyeU5EWUN2RlpFQmN2U1FPQUJpYnJVTldUX2dMb3k2QnV5cHJYRi1ieXR1czhUQWUwQV9HVEgzOEsxaEhaY0d1eENOSmxCbTE1S2I0RklWZ1EyXzA0UXlJNlZqdDd2a3BxcUt2eVhWRF9SLUxFc3BXODlaOTBoQTQ0Zzg1c05hcDRCWXRqZjZBSmxCRFJZSUJUUnZza0RFQmpickJqekk3c9IBxAFBVV95cUxPRFJKN09NdmlYTk5yOFFveGw1RkVJeVNZcmdOeFlLMl9TeUJ6c0hZekYxXzVHYzhOZkpqU1ZEWEo0LTREdV9sOU5pTjdTR1ZrdnhEeFM1enpRWW9OT0dqMUt4Z0xEc3ZkSFZrWWpyTnVLSGR4NElWNUJlUnhBTHZaN2ZnbUhZa0dpVmlEMDlZWFlKTjd4RnZ3eXFKYjJTT1ZObF9RRGNDeTltdnZMYTdlTGEwQmp6Q0dsQ3czRWxTdWJYeEJI?oc=5&hl=en-US&gl=US&ceid=US:en,Money Times,https://www.moneytimes.com.br
Venezuela: como eleição da líder mundial em reserva de petróleo pode afetar commodity - InfoMoney,Venezuela: como eleição da líder mundial em reserva de petróleo pode afetar commodity  InfoMoney,"Sat, 27 Jul 2024 07:00:00 GMT",https://news.google.com/rss/articles/CBMiwAFBVV95cUxNUGtUc1BEdHo5cVg1NFBiQUNzTWVOVGtZRF9McjJxZE1lZVIxMWhDelh2dGhwV0dmTkVfQ0pXRG5yd0l4VndweF8zaDJfUUtDanNEcWN3UjBRWXp0dEpfc3JzNlpuQV84c19PTGlzRkJqQ3hjX3dBT1FnancydUsyWXEtVktKeDhpNjJMM1gwM2xVLWFieXY5a3J6eFhSYzZXNzNOOFRrRmtDNGUtc2ZfT3lGSU9IUW1wcDFhQ0VJakbSAcYBQVVfeXFMT2ttYlVuUGtYN3dnTGxxNmNRVC13REttR29BdWJBaEJndF9TYnBoRG9sMVUwVlE0ZF92c0p3c0dpZkxRbXY4R1JqNlFXOXVwMXNXT1lDV2JGekIyclp1YnNSZkZlYjJkMk5MVW52SGN0SHdjU3NVSVlKTGs5b2E0X1luYUJXeXZKWUlsSHhWS2psQ3pPd2FDbEtJd2xCczVHSGNCYmlhMEV3UnhqNHI4QWFqZlF3dzJMUmVpbnJmbXlsRjdhb0xR?oc=5&hl=en-US&gl=US&ceid=US:en,InfoMoney,https://www.infomoney.com.br
3R (RRRP3) + Enauta (ENAT3): vale a pena ter a ação da empresa combinada? - InfoMoney,3R (RRRP3) + Enauta (ENAT3): vale a pena ter a ação da empresa combinada?  InfoMoney,"Thu, 18 Jul 2024 07:00:00 GMT",https://news.google.com/rss/articles/CBMipwFBVV95cUxONGlPU2NWaGZ0MnB5Y1hoQkIzeXhDby1RbTZEZTNjd3pvQ19vaUtoRmg2TG5nM2VQbzFWWkluQVlXSDhBU0ZELTBPVHhGN0E5eExmeEFpQ3dKUnhnOENVblFqbFNEWTZLRkwyTVZiOFc3TjNBSTVxLUMycWJxNWROX3BydEFqUWZaUHVBS2txemJlemt3UU5JMVYtYUZiNDZZRk1YQ1FLWdIBrAFBVV95cUxQeTNRYVhRMmVhRmhySXItZXgwYU9WbzZuTl9YLTRJNURJaktvcm1SbnhpY2w2SEhxSC1FdjJGVFRVSDFNSWZZYld1bU0tUjl2WGpmcTdfNGJqenNVOVVnTXdsOXZCdDk5ZkhoSnRPOVZhb3RDZ0pjeHhpSWhtYmJMV0w0dXJyal9MMUZFajFWMUl0T0FlQzM1Z1BXTXpGUDF1Y0hSd0lXUDBHNXpa?oc=5&hl=en-US&gl=US&ceid=US:en,InfoMoney,https://www.infomoney.com.br
Bonds de empresas brasileiras ou debêntures: qual paga mais? - InfoMoney,Bonds de empresas brasileiras ou debêntures: qual paga mais?  InfoMoney,"Thu, 11 Jul 2024 07:00:00 GMT",https://news.google.com/rss/articles/CBMipAFBVV95cUxNNU9KLXpST2FKTXN4Nk1VSm1zYlFNdWhOMWl2MUJEX0xVQ09wOHp1SnNHQjh4SElpSTZrZkxRbkFwZngweGNZdnVSWkpOUE5FSElOaFZpY1p4SVBtZE4ycmpsLWUteVZWeS10OGRUcTlQcUQ1SmR1SUo1OHJwNzVNNnVoVDg2WUxtdWJaLWthaWNhLS1kNWpyOE0tcXZXVlRfdkhyStIBqgFBVV95cUxQUnlONnYxbEVrdVZLcktFalVUYTRfaU5VNU14WnpEZ18zUDJzbU1keHNYODZZM3ZEYTFSNWhnaHp3WVh3N0R3LW40V0c3aUdYM01XTFB3UVZqcjZsTVJvN1pYYi12cFZJU0xxMUpfNXg1N3BvQWQ0M28zZWJWamtsQ19YWVNHbHdNWlA4NzdjZENUcTBYVXpwdXdCZnBjZmpTbjQ4RWtJX3FXdw?oc=5&hl=en-US&gl=US&ceid=US:en,InfoMoney,https://www.infomoney.com.br
Ambipar (AMBP3) dispara 20% em um só dia na B3. Ação triplica de valor em um mês enquanto mercado ainda está atrás das razões para tanto otimismo - Seu Dinheiro,Ambipar (AMBP3) dispara 20% em um só dia na B3. Ação triplica de valor em um mês enquanto mercado ainda está atrás das razões para tanto otimismo  Seu Dinheiro,"Wed, 31 Jul 2024 07:00:00 GMT",https://news.google.com/rss/articles/CBMimAJBVV95cUxOWjZEODBPNWo1RHhWSlpUWTRvcl9kOFp3eFI4VDR0SEkwVG9taHlBWW9TQTZZYkFHR2dHODA0ai1yUmM4WGlSN3FRWGotZHFGcUUxTXhtMW5LTm5oTkM5bXVqOGI3eDFXelV2eWtpNThVTTY2Tkg1ckJmSzYtZnltVXpRNlNVQ2FhUjZ5LXVJYmhQTkx0ZFR4ZGdtLU5Za29TQlc0ZTZobTMxcHhfYkk0d2tRZXJlb1lfdS1Sbl81amd6b0RNNmlSb1JBaHk1YTN5QXN3N3Fkc29DMlhfRC1EcUxaZW5ZdkRoQkRXci1CZm1xWl9Bc3Z4ejRRbDZvYmJwTTZ5c2ZKN0R3d1VNVzRTNGhVS0NrRnFn?oc=5&hl=en-US&gl=US&ceid=US:en,Seu Dinheiro,https://www.seudinheiro.com
A bolsa brasileira ficou ainda mais ‘barata’ e dez ações podem ser a saída para o investidor lucrar daqui até o final do ano - Seu Dinheiro,A bolsa brasileira ficou ainda mais ‘barata’ e dez ações podem ser a saída para o investidor lucrar daqui até o final do ano  Seu Dinheiro,"Tue, 02 Jul 2024 07:00:00 GMT",https://news.google.com/rss/articles/CBMiogJBVV95cUxNNExETFB4aW15VkxEV2hTaTl5ME5nbXh4dlU2Tzhqb2FaLWNYT0hSdXJmZGRDUkhaYlh5cXN2N2JBcDJpcWlUdGZFaXJFRGkwTEIyX0p5OVprRWNBWTVhZzJBTlY3eE83V1FRUlM2MXdIblVJdzlNU1V2Z1RSdC1mVzBUZ1kwTnBoMFBsNjhDQzRMLTVXU0sxelNtbDN2a3R4a0pHUm0yOGFZd2RkaEZRUDBZandqQzA4UUFTVkhyaUpudDlyZWRUR2k1R0dnVzUySmt2azR5RVZKeW9qZE91TjI4TG1hcE5ISDZkT05kMkFwRzJhekhCbUFfNmpHUTFna1V0NnFtbDJ2YkZZMkNMNFhyV0lxUk9lYXpadW9mNVFwUQ?oc=5&hl=en-US&gl=US&ceid=US:en,Seu Dinheiro,https://www.seudinheiro.com
Calendário da temporada de balanços do 2T24: Confira as datas e horários das divulgações e das teleconferências - Seu Dinheiro,Calendário da temporada de balanços do 2T24: Confira as datas e horários das divulgações e das teleconferências  Seu Dinheiro,"Mon, 15 Jul 2024 09:08:10 GMT",https://news.google.com/rss/articles/CBMi7wFBVV95cUxQWG1rcjhpTzVHNmNIYS15OUpsb3BhbExzUDh6aGIxSXNvUmJYS2ZzcU93WFF1VTE5cV80YUsxaGdLN2J6M2t5ZmVlTkRjZlduY01LTzU3SlNqV3pXV0ZJa3UtdFl3cVVfeDdCN0YwLUNnMjZmeVI1emhqVHhDbnM2dnk1VW13RUoxMW80STB4bTV1bE15U2hLamNlMUF4VVBhMUtwdUExbHhQNDJBTkRCTmZ6dEQ0NWdQbDNQaXpmSlo2UFRJZkxPMklaelR1dklRX3lKSE1NVVRYcmVCcjlVRDJrb3JPTFN4N0NxUTBiVQ?oc=5&hl=en-US&gl=US&ceid=US:en,Seu Dinheiro,https://www.seudinheiro.com
"PRIO (PRIO3) tem queda de 23,2% na produção de julho - InfoMoney","PRIO (PRIO3) tem queda de 23,2% na produção de julho  InfoMoney","Tue, 06 Aug 2024 07:00:00 GMT",https://news.google.com/rss/articles/CBMikAFBVV95cUxPZDNUc2t5bFB6NmJBV0ctbWZJYnZVTS1QS245ME9Xd09NRkxRdmdaYmJuV2ZZN1N4U2FONEJpSVhLbmwwNWJNUWZHWFpGeG95SzhEVkVFUFJQVVhBNWlJaXdFZ1dpd1lGYTB0NVJJNFY1WUFCalBQTmlVU0ZuUXlvb0FmaXVPOGd4a2hjRGtQZUzSAZYBQVVfeXFMUEN2VWg5V2lobHV5RV9SNWF1N0tsd0NvUkl3ZVhxZEJDR0s4UFpMelI0M3Z4N0JHZ3lyOWdXYUc3ZHU5MXlBLUR1WmhWWFB6S1RXNHdwMGtpRHJUTEJYTGg3dGRIT1ZkdHprOFBlN3NGQS0ydktPTkE3cHFmUy1tWVZGOUlBOVBvTXlpT0dkUmJYc2s5V3d3?oc=5&hl=en-US&gl=US&ceid=US:en,InfoMoney,https://www.infomoney.com.br
"Prio (PRIO3): ‘qualquer queda nas ações no dia de hoje nos parece um bom ponto de entrada’ – veja 5 motivos para investir, segundo o BTG - Empiricus","Prio (PRIO3): ‘qualquer queda nas ações no dia de hoje nos parece um bom ponto de entrada’ – veja 5 motivos para investir, segundo o BTG  Empiricus","Thu, 08 Aug 2024 07:00:00 GMT",https://news.google.com/rss/articles/CBMiiwJBVV95cUxQWU9QY01Md2J2ZWlfbnFyV1FNRExlY0lVNm5CaGowcWdPOXlLM2ZxSDlUa1pPLUhjWGtBOEtiTExqRkJGeVlwS0paVTl6SmFoMHZPNDZTeE1oNWlTal83NGlPNlFaVlJ3RVV0RUdhMGRzRFlSRVNYVG8zenByek45V0tSemJqT0J0QmU1ODJMSGQtVjJKTzYzaVpwU2MtbGwwUlNXVzFjcGxnVUZJRFJYRVNrLWU4TV9PYkRtTXU3UkFMcTVCU1J5cGw4bmtnVkdiWm1WWHNlaDQ5Ny1VQlBpREtJZnV0eTI4WUZFX0tRTHVTOHBMU0RMYno2MnV0a2c0c2J6eWxtSGF2Rjg?oc=5&hl=en-US&gl=US&ceid=US:en,Empiricus,https://www.empiricus.com.br
"Prio (PRIO3): Por que produção de julho foi ruim; ações caem 2,6% - Money Times","Prio (PRIO3): Por que produção de julho foi ruim; ações caem 2,6%  Money Times","Tue, 06 Aug 2024 07:00:00 GMT",https://news.google.com/rss/articles/CBMilgFBVV95cUxOR3lyVnplYi1vU3VYbk1FeFBBakw2NVUwQk9paGduQlNMc2V2VDVLY0JtT0kyQTJWbE03UGx0X05rTGY1Y1J3MWNNRV9Gc2IzMzllcTVDY1BfZ09rb3c2eHdUZG40bHJkZ3p5TVVMQVVNcG9hZnN2QjVRemE3TlY1MnN0NW5IaVF3UlVVX19mQmtXYTRZeGfSAZsBQVVfeXFMUDlrSjF5cTZBMkNMT1RmdjZ1M3RoQVd2S1dOYlFkdXNyS3NQM0pFam9LOUZvSWJVSElmQVM5SnJrMklaeUhxX2FLbFJIZFgzRV96LV9KQ1dKQk1fVjBQV0xEMkYzb2NjQnhCYkVsYXRzTzFJV3pHdnNMeHB4eXZENEtwS09qOUtLZFpFYjVOUFpjTV9mY0hNZGVXS0k?oc=5&hl=en-US&gl=US&ceid=US:en,Money Times,https://www.moneytimes.com.br
PetroRio promove esportes 24h em plataformas offshore - Você RH,PetroRio promove esportes 24h em plataformas offshore  Você RH,"Tue, 27 Aug 2024 07:00:00 GMT",https://news.google.com/rss/articles/CBMiowFBVV95cUxNU3J0SEEweGJOQjl0ZVNlNE01QkVxZkd1bUt5bzBoREdjckN4NVhOdUI1SnBIaE5xYVpfQjZyQlpHZ1hWOGRFMWx1Y1pOU2lTOEpRUE4zSjJvTEpmMjFEZzQ0dDE2ZUUtWjZkRk16bnptUFM0QkVXN2pQWWFMT2pILThwbGlRbmZZWk15Q05oQ19RelFISkF6c05PR0VkNnJyUGxr?oc=5&hl=en-US&gl=US&ceid=US:en,Você RH,https://vocerh.abril.com.br
Valor de mercado da Petrobras (PETR4) 'salta uma Prio' (PRIO3) e ultrapassa R$ 541 bilhões - Valor Investe,Valor de mercado da Petrobras (PETR4) 'salta uma Prio' (PRIO3) e ultrapassa R$ 541 bilhões  Valor Investe,"Mon, 26 Aug 2024 07:00:00 GMT",https://news.google.com/rss/articles/CBMi7wFBVV95cUxNTkpwUm81TzJjRXExN1A5VUp2UVlpbTNiYk1GNUNxQWkwS0xTc2RMUlNSNTN3QjNIbnBwck1mZzRGMUJGR0tQeUFMeERiNV9EWGRGQzZlQ0pQc2FYRXVHbk9kRU9iaXBlNWwzZHNFMmdPUC14eFpTMTBuYkkwZkpkZ3FwMGlUMzhJQUZySzZ0LVl2QTFEMHNabjBRZE1sVmQyck5qOEZ0dDQ3RUhLeG9SUnUySnlvX09QVjlNek85UTRtVlJfc3l0NVIyX19TOU04Q3dmNm1VTmJKNy1OUHAtVzl0dFh4Zm1yV181dnhRNNIB_gFBVV95cUxPU1dMdHlGV05PN245Z0FxMmRlZnlFdVBHcFMwazVlTGFBQzFhWS1wUVZVZ3pRWXExRDhpcmhQbENFSVpSUG43aWJxYXpxNFlzZkFDdEJxYkd3YnR1U3hhXzZ0cVBZLWh5VkN6Mzd2dWZ4akxiTFJDdnNlYVpta2F5NDU1VXJKQnU1d2NqdHluY1VQeW5QVElSeXI5Q0lpdGVDZkw0b20wMTVFQWFCN3JqUGJ3bExycE5PWVR4QmN3cUVuNlEydmRSX2VXLUJ4aVNBSkQwOXN2bHlDRmZsRzVyUkhSNUxaaHVjRWs5ZWdQekJGMVhzMTNqUGIyUUFnUQ?oc=5&hl=en-US&gl=US&ceid=US:en,Valor Investe,https://valorinveste.globo.com
"PRIO (PRIO3): Produção registra queda de 23,2% em julho - Investidor10","PRIO (PRIO3): Produção registra queda de 23,2% em julho  Investidor10","Tue, 06 Aug 2024 07:00:00 GMT",https://news.google.com/rss/articles/CBMinAFBVV95cUxQNnBvWWNYWjhMQjBDVU5WVXBoaXJrZmZNQW1OVTY5bkc3MUYycDBpbzhHUjhhbnpBS3IxLXZKZU4tcFNoY0FOWUw1V2ZGRFhjTDJiM2dzbXBOU25YY3RDQklHXzh0UzFmdm9NcXNrRUxzLUZvNTVYYlVkNlhYcHdWcHFhUkFzWllLMWZtbFVBUWFLZkhFZ1lEU1RYdFTSAaIBQVVfeXFMTjMzM2YwaTVxWUplRG1WQzZiUS1oQWFucUNKY2FKdTczV1d3Q2p6RDZyaFhUUVEwQnFPU3dvOVo0MDdPOGRwVGxrVzZheXR3bFhLTkEwVnJwUEdCbjRFU25Vckk2QXNaTXVOTDZhSXlrODA5UjVoRnF6bVJtZnJIWDAzMXR1N29CaXR6SFpVSVFkZVdwRVdsM3FiLTlzZDRUeVVR?oc=5&hl=en-US&gl=US&ceid=US:en,Investidor10,https://investidor10.com.br
"Prio (PRIO3) ganha notícia positiva que deixa papel menos arriscado, vê Bradesco BBI - Money Times","Prio (PRIO3) ganha notícia positiva que deixa papel menos arriscado, vê Bradesco BBI  Money Times","Mon, 19 Aug 2024 07:00:00 GMT",https://news.google.com/rss/articles/CBMirAFBVV95cUxQMzdNVHZUMXhHOXJkemplRU05MHpvc2tTYW1zWWUtSlpQeC1RXzhYYUpPekM1ZllXc0lCTy1tRWxXWnhWU2tVdWo3WWd2SmplSW84UzZJR1g5ay1OVjUwVVZuSF9PTHBsR0dXS01FMnpBRFdQaHpSQUpRUnNYUWhhTkZ5anpvUUh6dEx6VGEtbUVOLXI0NHVLaXFGNVptUmxPYi1CbnUtUWNJVWxH0gGyAUFVX3lxTFBZR2JFeTFPVUZuT0tJZlVXSFluaS11cXhINTduTVNmaUJfWkpUaVFJSUthV1Z5d29QWU9EWU5Dc2hhenZaYktEYTE5bTN0Y2ZYTmtFcHNJVHZ3Z1o4eVhPbkRnVzRNeEhKNlAwTjFmeVlkSUR3dnUzcl9fZVJrSk5FbWZuWnlZSklWTXI3VGxhU0hPTElKWHNHeDVmLWFsS2k4dXNwc0laR3BkTzhocFdFRHc?oc=5&hl=en-US&gl=US&ceid=US:en,Money Times,https://www.moneytimes.com.br
PRIO tem recomendação de compra e potencial de alta de 38% - oespecialista.com.br,PRIO tem recomendação de compra e potencial de alta de 38%  oespecialista.com.br,"Mon, 26 Aug 2024 07:00:00 GMT",https://news.google.com/rss/articles/CBMikAFBVV95cUxOSmtGQUVJSEp1YnVHOGJkRjVYNlZ1TGxMeWlNZTZUSnFIUEI0NVlUZXNuUnk1TzFab0hkTXgtak5Sd2hLRXFYRWI0aTZMU3preTAxZ1I5OFV3SkFYd3UwVDVPaUczYzB6ZmhUSUt4ODJoZlQ1bzRDbm81LWdBRmN5OW8ya3UxR3dmS01TVFJnWFE?oc=5&hl=en-US&gl=US&ceid=US:en,oespecialista.com.br,https://oespecialista.com.br
Prio: lucro líquido soma US$ 272 milhões no 2º trimestre - InfoMoney,Prio: lucro líquido soma US$ 272 milhões no 2º trimestre  InfoMoney,"Tue, 06 Aug 2024 07:00:00 GMT",https://news.google.com/rss/articles/CBMiigFBVV95cUxPb2N3Yjl2Q2FDaWlMeTRSM1V2OU1QSGtXOVNJejFsTm5PWUlFOElZaTNwUXV0UUZLVWNCVW5Oalo2c2p2UkpnOGtGMUtEMDFJZTlZdXd3Ym9jUXVhUy12bEF5eEZDMi11YmkzTjFyWklHRUY4M1ViTWt6dGlOWVlOOXgtM0F4aVNfdlHSAY8BQVVfeXFMTVhqMEFYdE9lS0djQWl2U3o3MFJjdU9ZR19ldjJFNnpzRER4RTVNZ2dqZDNfN1FpSUxoaWVDX1VrRU1WQ0tfaTJIbmZpcGVlcE56T1otU0ZSSENVMHZ4cTRJbkVTQk5MUlQ2V0hDWDY4d05Ya2RrVDB0YUhOREs5Vnowc0hTT1hkc0NqMnN1SEk?oc=5&hl=en-US&gl=US&ceid=US:en,InfoMoney,https://www.infomoney.com.br
Ibovespa: Petz (PETZ3) sobe quase 40% em semana de recordes - Estadão E-Investidor,Ibovespa: Petz (PETZ3) sobe quase 40% em semana de recordes  Estadão E-Investidor,"Fri, 23 Aug 2024 07:00:00 GMT",https://news.google.com/rss/articles/CBMijgFBVV95cUxNNUdPOG1ZYkhFYm93bU4ySWtNdGdJU19JaWJmcjlRTE55RmpJTzRLWG5GdnEtcTE3M2QzYTNzSFp1dlFjeFVwV3ZiVjladTRuYnNoVkpPOERGM1pLNW96am9NdzdyMmZLRlRybWVFYUFQd2l1bVpZcjQyNzhpUkZBOFJSS1BmLWpMUzcwcjdn0gGTAUFVX3lxTE9yeHdQRGNubjBEVWxueHpmX2dtRk5fcGJTbHhVOUNMMUtTenhQR1NIbG9hcFFLU1BQZFVwbF9fVV9DaGtSSzc2cmZDbWpJbHFBOE5aMkptVTdjSlE2Z2FDdEJNY3FwbkZBWGJrNUR5Q1pmZDJKU05xMU9GVUtyOUZwLTJLWWVrQ2lxbzVibDFVRTVMYw?oc=5&hl=en-US&gl=US&ceid=US:en,Estadão E-Investidor,https://einvestidor.estadao.com.br
"Prio (PRIO3) reporta resultado acima das expectativas no 2T24, com melhores condições de comercialização do petróleo - Empiricus","Prio (PRIO3) reporta resultado acima das expectativas no 2T24, com melhores condições de comercialização do petróleo  Empiricus","Wed, 07 Aug 2024 07:00:00 GMT",https://news.google.com/rss/articles/CBMi-AFBVV95cUxQSzZ0ZHZzMkhWOVdRUGNtVFNFS05FQVRxc2hrOWl0VVZTS3BsVWZMdUFoMnJkbWM3ZS1SZDhaOURTeWlGSWZfbG1vUHZTcnFHLUhKZHJhWldVd3UwSTh1bFN1Xzg4R1o5VW5MaXlKTTZmUUJrQU5fNmdJeF8zMmsyOHpKcnI4RFZURUVPaHVVeUJjeXBkYjRNZkppMFBMY013Vl9qRFY4Vk1SZWxTbWJpd2RQemtXcEVhSVAtVjhsMHZkQTBzTG52Q0tneUNCMXlka1Q4OGNBQ0JhZXlNVnQyWEpIQzhNYnhrdjJ5Y1dORUE2b0h3Y1p6WQ?oc=5&hl=en-US&gl=US&ceid=US:en,Empiricus,https://www.empiricus.com.br
Confira as ações mais recomendadas para se investir em agosto - CNN Brasil,Confira as ações mais recomendadas para se investir em agosto  CNN Brasil,"Fri, 02 Aug 2024 07:00:00 GMT",https://news.google.com/rss/articles/CBMihAFBVV95cUxOTkZQOGlXM1BPbUh0YmdtMDhNc0tuQ0JQNjFrRC1QWk5HcGtaMjd6OGstOUlvRGFUOTJxQ2VxOXpEWXkya2xBSjVzWUVwbXNSOHhXVGRVa1JhVjJhMDFVS1o0cVY5aDV4Mk5pVUcxRkpiNVRYSlcxOHhYVjB2SFM2d1JQVGY?oc=5&hl=en-US&gl=US&ceid=US:en,CNN Brasil,https://www.cnnbrasil.com.br
Petrobras fecha em alta de 9% e ganha R$ 41 bilhões em valor de mercado na bolsa - Exame,Petrobras fecha em alta de 9% e ganha R$ 41 bilhões em valor de mercado na bolsa  Exame,"Mon, 26 Aug 2024 07:00:00 GMT",https://news.google.com/rss/articles/CBMiswFBVV95cUxPbGpGdFF4RmlLb1J1U2djRkxhZ0dzZUlyUG5mbXA2elRBYkpRa2ZIaGkzZ3E1UlFfNXlZV056N2d6NWR5eFF5RGhmdTVMaWQxZUtMUWo0UndDNEd1SWpFRTR6d25xeWFrMk9feVZFdFZ4Q2VMVEZEdnZJX2xidVBXNklSeXVwOFNJZ2tWSVpEc2dhNFYtQ2Q1ZWE5TjVKUHJEamJOQUgwVGE0RlhvZFB6eUlOMNIBuAFBVV95cUxPX0ZDMnN3WWhGajhHaG03eXlVREttQlJDU0J0YjNrWEVFbkRLWlp6MmcwTDR5NndNQ3MyV2xnanQzUGUtWTRWZ3l4UDh6RWtLQzVPcS1iNkU2MUR6RDdiX0R2cVlNdWVzZVMwSEFYRHZ1S0xSM2FDMlRNYl93NHU4ak9adnk2c0VudldSbGp4WDdYNlhZdjhOaHdjTkhNSTBuRExKUjJKNVVZZE9kRWd3MTVtQklVUVZU?oc=5&hl=en-US&gl=US&ceid=US:en,Exame,https://exame.com
Prio (PRIO3): Safra retoma cobertura com recomendação de compra; veja potencial de alta e mais 3 motivos para investir - Money Times,Prio (PRIO3): Safra retoma cobertura com recomendação de compra; veja potencial de alta e mais 3 motivos para investir  Money Times,"Mon, 26 Aug 2024 07:00:00 GMT",https://news.google.com/rss/articles/CBMi5gFBVV95cUxNSVd2TDlKUVRUSkZnazFiNnQ2V2JVV1FDWW1hdXQ2SEdmNkNxMWMtLWUzVzJIaUgtOXUxNFJfbGVJaUkwV3RZS2pDazh0WmlEMktvOXJHYnR1Mlo2X1VjRllkY0pXeHd6cDZaLXdFMFRjNHBZaWw4c25OZS04QmMzSUk0RVlBMG9nSER1Z1hZdG92M1NCdjZkT3pJRW9Gd2hobnN4cmV4NGFOUnpSWk1VOEpPT2lNbEo1Uk1QdXRtdk9OU1Y4cHNZbWs4d19Bc082QnVlb0lWdFpoeWV4bzlJVEFnaTJVQdIB6wFBVV95cUxPeDFLbFRNZVpYX1RwWTY1OFdQYUNXTm1hSURoOEN4blFTZDFkR1RDMFNYN3ZyRDhrR0Y0NDEteXg5RUhmQUR0OWxQU2dRMUI3RHFYVUNuS0ZoSzJPUkN4b1RyVi0tZ2tfVzVoMHVicUVNak14OTcxSkRSM0lfZGwyTGEyRnR6enhxeElSYWV5bHhqNzNXUEwwempDUmprZlVlRkZRX2Zpa0VrQjdabzh1elcydVlQR1BaTUdWcm55dWREeHh3VjdqeTBuWjM5V1pNMVZ6Y3B0NW5heVpHQUYwX3g4WVpjeEJNYXM4?oc=5&hl=en-US&gl=US&ceid=US:en,Money Times,https://www.moneytimes.com.br
PRIO dá grande passo para importante licenciamento de campo; veja próximas etapas - InfoMoney,PRIO dá grande passo para importante licenciamento de campo; veja próximas etapas  InfoMoney,"Mon, 19 Aug 2024 07:00:00 GMT",https://news.google.com/rss/articles/CBMiwwFBVV95cUxNSDhLR0I1OTBtaXJKWGxqMzJJVzZfQlVXOHNqUFVuU2ItY1ZPQ0x6U1J3VHRJSkNTeDFBOXRsTkR3TG51ZG00U1Bsc3FURDNTOWpLY2JtQ0FUUW9vY19lUm8tT2ItcFNMY2tnRFBBZGVlOGFOcjd3bE1QWlpOZHVNTDZ1bGp6UElkMHhCVEE3ZHZrSUF1Y05pSUtodThyMHhtTmFCdUFwRjNXRDRkZFZINGMzZEVZeGZSWmxYUVBKUXBQbknSAcgBQVVfeXFMUDhuQ2hFT2ZIVENPdWJidmtYVkdIdTB2NGVQek1rTXJSYkZFckh0QUZ6MVk0LWtaem8zT2FfU09pb1ZFN1NPVDlnWGJENkhIUlhIZjFHeHZTRGEwRE4zd2VyelZJNkYyYTAxV1RZbXdpNi1aUEVQbGpzcHlHUGVyM1lHemI4SHpIalowZUVrNGpSUFU2Z1gzUDNoUHFkaXZHdkdmNnk3RE1VTk8zREczM0lCUzh4ejBmSHNtaGRGNUgtQklSeGotUFg?oc=5&hl=en-US&gl=US&ceid=US:en,InfoMoney,https://www.infomoney.com.br
"As melhores ações da Bolsa para investir em agosto, segundo 10 corretoras e bancos - Estadão E-Investidor","As melhores ações da Bolsa para investir em agosto, segundo 10 corretoras e bancos  Estadão E-Investidor","Mon, 05 Aug 2024 07:00:00 GMT",https://news.google.com/rss/articles/CBMikgFBVV95cUxQMzVRcGtnSURmSHE5MDZ4WGUzbEtmTHBRVFZJX3ZFbnBiT1pPNm9HNENFNUYtNFFLcGlDUVQyTDV5dVJxdjJEM2t0Q3FtRVV6aTBxd05DQ1ZtQzV3LWtDcVhTc0JnaHpuYjl6SlNsMmxmWllxeEVnLThnbjhfaWtjaTBHVEotY09UekFQWkJydlNWZ9IBlwFBVV95cUxONTdWMHVTVGYzNmdTb3QtTjJ6V3FZTlpaZjltcnp3ZnBXVU1jblZPSDBOU0dsY0NJVUJtdTc5MFRqYkdRMFJaak1mTG5WZi13eFItbGdhMjZHOFpMVGhPdjBxbzVGUXdhY1R5dTJzNmQxSjloY2V2WmNHcVh4TVBuSTU5SGpZaGM1Zm5scm5FcHJsaUZnQVFz?oc=5&hl=en-US&gl=US&ceid=US:en,Estadão E-Investidor,https://einvestidor.estadao.com.br
"10 ações para investir em agosto e bater o Ibovespa (IBOV), segundo a XP Investimentos - Money Times","10 ações para investir em agosto e bater o Ibovespa (IBOV), segundo a XP Investimentos  Money Times","Tue, 06 Aug 2024 07:00:00 GMT",https://news.google.com/rss/articles/CBMiuwFBVV95cUxNeE5Wc0ZSc3o1UHM4UndOZFNyRkNNS0d4YWtSYzZKREttdmJfc1ltdDNpQzYwYXFUZUZ4RVgtTGtTZ290QjhDaWg0cllDUGVlRi1yR0tyaXdfRUxNcXBrN2JNd3E0aWFMSFZ5U0MyWXJlVkU5QU1JODJDWW45Q01CeUNtejRqcjZzcDM5SS1iemt5SnQ2RzZWOHFra3FmVmJrZWRreEEzUFNiSy10WE1MbTB6bDN6R0g3c1NZ0gHAAUFVX3lxTE0xdlRSZTVHQUhLU09mV3dUU01jd0w5M2VqQUhuYXRXRXFhWlJyME5XMkwyZ3lrUkJybmpHcmR0Y1VNWVZ2SkJkaG0yNXZockxsMHc4Z1RtU1JJSkcwZWwyd2puVTRnYjZnV3ZRa2RUSmRoVlhRVXZkNklYcVRCZUJqcHhxRkl6OG00MHdRTkR5TXhmdGw2cVlnbXV0cmZ2R0paMjBXNG9YMl9Zelh0VVBGcFB3T0pPalpUbTBJSmNpTg?oc=5&hl=en-US&gl=US&ceid=US:en,Money Times,https://www.moneytimes.com.br
"Ibovespa termina sessão com queda ampla, após correção; Azul despenca mais de 20% - InfoMoney","Ibovespa termina sessão com queda ampla, após correção; Azul despenca mais de 20%  InfoMoney","Thu, 29 Aug 2024 07:00:00 GMT",https://news.google.com/rss/articles/CBMijwFBVV95cUxOR2p6OGxqVEJsMzNQWW94SExqdEZkbDFOMEJtOHVBUjlOLXFVQ3d4OHZYSDIxY1MxRC16NFVCYkFheUN5V3BYNWo0NXlEQjI2bVRfUDVHOFpxTHhDMW9LQ3pUaE5wdUFxeWlPRkNrZG4wcFhRY202U2xNa1U2UjkwdVU5amJLOXdSOTR1ZGhwNA?oc=5&hl=en-US&gl=US&ceid=US:en,InfoMoney,https://www.infomoney.com.br
Petrobras salta 9% e ganha R$ 41 bi de valor com ações elevadas e alta do petróleo - InfoMoney,Petrobras salta 9% e ganha R$ 41 bi de valor com ações elevadas e alta do petróleo  InfoMoney,"Mon, 26 Aug 2024 07:00:00 GMT",https://news.google.com/rss/articles/CBMitwFBVV95cUxPLS1nRWxoTjZWNlB3THNoVHprNFZfVXdrTlFQNWtYdnJhVDhseG00Q2NCak1uaDYtY2dsV2FMUTN5SzI0ZHdFT1RKX3lwR2Exelh0WFhjUGJ4UzZqMkhCcTQyWE0xQVcxRnBuRFF1QjVON0dzMWVWTGlkRUEzN2NCR3RsNkhmN09uSFl2djJrck1MeWR4aHlCVEpVSzNnV2xJVjkyUUhfVEd3MG9aMXFlTlJ4SDJ3QkHSAbwBQVVfeXFMT1VXd1RhWmZrS3d0RWVCTDhuUzdSbUdiTE1VcVpCdllFdEdDRkw2cFNTNkxDMWUwbkRzRmg0VVFhQlpLeTNJOXlUZnpXaDN0YnAxUmNCNEc5X0s3NVE0LXpfQW93NWZaVVZaQXcxS1Vfc3BmQXo0ZnZkSEJOUjljMlZmdjViYVNMTlFUY251aG9rdTNfeG55X3otTkxfejh4ZzZCQXAzQUY1Y3lfOFh6cUVPSVlGem1SdmNNTlU?oc=5&hl=en-US&gl=US&ceid=US:en,InfoMoney,https://www.infomoney.com.br
Petróleo sobe mais de 3% após exportação suspensa por Líbia e com atenção a Israel - InfoMoney,Petróleo sobe mais de 3% após exportação suspensa por Líbia e com atenção a Israel  InfoMoney,"Mon, 26 Aug 2024 07:00:00 GMT",https://news.google.com/rss/articles/CBMivAFBVV95cUxQeXRJYWo5REJZQkJUNTBUdU9mYXdveGpoLS1GWURYcDVTNGkzX080bTNpR3gySEdKenY0RFd5RGxqVFhuanJSTmFNeVFpZks5RjdGQjNiS1dPZ0hzMzJyLVl4UTVVUzE0X09PTThDRDRoTjJ0YW84Z2NGNWZXN1JaY2hEYnVDSnNuNHlxQkRwOS1penlqbENhVnZfTDR0VVZ1ZlEyaHdJUUFaSmVIMVhEaGhJSU5ES0xCZklKTNIBwgFBVV95cUxPTm1ockhBdjdYQ0ludEQ5WTU3WjR0QVpyTXNMTEVVLVhJX1ZVVHNGRG45bkhCMmxFdVFsZ1VFTnJZcDJqQ1MxdGc4dlZkTlhnNlhBWkI4OXNaVmVBSGRuSXdrQURmYnY0bzVvT2h1b19vLVZVQ201Qm0zVDFud2NWWXFVZkZkTDUxUkVaR2lJd1ZhbTNpeTVYWG5VZF90MGhqRmM4NHEwVURaYjdMeDRLVHpDNkNTSFRjOTZ2WFBvTzhudw?oc=5&hl=en-US&gl=US&ceid=US:en,InfoMoney,https://www.infomoney.com.br
"Com ações no exterior, Arbor Capital atrai institucionais e aumenta AUM em mais de 25% em 2024 - Funds Society","Com ações no exterior, Arbor Capital atrai institucionais e aumenta AUM em mais de 25% em 2024  Funds Society","Tue, 20 Aug 2024 07:00:00 GMT",https://news.google.com/rss/articles/CBMiygFBVV95cUxOMHNFbHVudmdnd3Ixak5meHRoTjlaQ01tdy1hc01CT2FBaVVZeWRZV3VURjkzdjFONHlVWl9yVTFyemdNREtCdFg1SVdGd01kLVllSnZ0YXZvOTU0ZVhaU2RWb2RXMXNERjhxdzhDay1RaDJhQmxKWUUyU3JIZzNsSm9FTjgwcjVxY2RBOXFmRXFVeW5VR2ZKNEk3ekxFUXJiOXhQRFRsaDZsVkNIekRzWURLVUROZUt5QTB4bkFWSGhuUnhXUTRhQktB?oc=5&hl=en-US&gl=US&ceid=US:en,Funds Society,https://www.fundssociety.com
"Ibovespa fecha com leve baixa, apesar da forte alta de Vale e de novo recorde - InfoMoney","Ibovespa fecha com leve baixa, apesar da forte alta de Vale e de novo recorde  InfoMoney","Tue, 27 Aug 2024 07:00:00 GMT",https://news.google.com/rss/articles/CBMijwFBVV95cUxQVTN3YkpjaDZGaVFVVDc3WGJIM1RDejZFZkpSbFhvWXVzSThCMDN3QUFYQ29hNTF5SVE0d2FYRmZQZ0lhNGE1OVFHSklpWk5uc2VDaTZyb3FYYlZRQmtuNFFBQUNkQnhETEowLU1mcThVSU0zSm5GSldIaDBFYnNtUTFtdHJGMG1NcTJzRnhHUQ?oc=5&hl=en-US&gl=US&ceid=US:en,InfoMoney,https://www.infomoney.com.br
"Ibovespa fecha no vermelho, com liquidação global; Bradesco se salva com mais 7% - InfoMoney","Ibovespa fecha no vermelho, com liquidação global; Bradesco se salva com mais 7%  InfoMoney","Mon, 05 Aug 2024 07:00:00 GMT",https://news.google.com/rss/articles/CBMijwFBVV95cUxNVURqOVhKNzB1eUlORnduMk91YVEtQmZLYmF0SDhPR3NuQ0JGR2phekhJM21nSUJMS1lyT29CcV9zZ3NGNzVyR2NpT1JSdmpkbWtHTXBfUE1wSUhPbXJJSHdWbVlQdFZLUG5sOHVhT2p5cXVleHQtbzFZNWVSRm1vcU5lNlVaNllmcmNhb3M3MA?oc=5&hl=en-US&gl=US&ceid=US:en,InfoMoney,https://www.infomoney.com.br
