title,description,published date,url,publisher_title,publisher_href
"PetroRio, a ex-HRT, planeja mais aquisições - Brazil Journal","PetroRio, a ex-HRT, planeja mais aquisições  Brazil Journal","Fri, 23 Jan 2015 08:00:00 GMT",https://news.google.com/rss/articles/CBMid0FVX3lxTE1OUUVlZVhrTlFKQ1VLT1h2STR4a25TWk9aN18wWXRsdFZCTUdHcnN2YWxsNW9GMUlpampoWEFCR1pkekZhMVNEYlY5U1dlcVIzWHR0Zk1MZmxTOExFa0pnc2tVcHZTbGY5UkpjZXNDT1psODdNNTBV?oc=5&hl=en-US&gl=US&ceid=US:en,Brazil Journal,https://braziljournal.com
PetroRio é impedida de comprar fatia da Maersk em campo - Exame,PetroRio é impedida de comprar fatia da Maersk em campo  Exame,"Mon, 26 Jan 2015 08:00:00 GMT",https://news.google.com/rss/articles/CBMiiwFBVV95cUxOdm96TjgxUUt2SHg5OUhPSHNNRXA3ZnhrS2Q0MkU0VUtZSGNIZ2N0WG5GWUJwbTJMVkppbWR3c0Y4YU1rRVJSV0VVWWdsTW5tcTJtZXRDTHhaM0dQc1g0SzhKYVFXdmI5M0pVRERTVGpEYzI1N1JiWVhST04xdlJvby1uUmwzTHVzRnlF0gGQAUFVX3lxTE8yYVZXcnFOZjdwZDlLRnBYM29KcHB0c1h3QUZLVEdwSkpteGJmLWtUSXRZc1ZwZjVnNGpPMW9GcDJsejV6WDRXZkg1YXpiWmc2amNiTTRVRWROYlN5TzNYUC1Jek8yMXlKY1g4dklaNmMwU2VaNmRfSzNocWYyMmxudlJjenhmZTNENzZHOVJ6ZA?oc=5&hl=en-US&gl=US&ceid=US:en,Exame,https://exame.com
HRT muda de nome e estreia ticker PRIO3 na Bolsa; confira mudanças para amanhã - InfoMoney,HRT muda de nome e estreia ticker PRIO3 na Bolsa; confira mudanças para amanhã  InfoMoney,"Thu, 25 Jun 2015 07:00:00 GMT",https://news.google.com/rss/articles/CBMitwFBVV95cUxNUjBIZldhV081Z1ZqN2VZQldUSnRlVUhzSzBSYUF0OHVRQzcwYlZxRThxRjhYc2R5OTlReVlIRG9DQ1pGQTNtUWNTWmpRNi1oUThUT0NnaFNxdmdwRDQ3NVg5ZW1JUF9EY0FZei1KTUQwSTBxMHFIakh2eVJmcHJtc1dvUWN4UnNCSEhxbm4ySXFsc3lTRFJtN2hYbml6SEtmUC1CMlRJX05IZkxfY3ppRTloMEE3TlXSAbwBQVVfeXFMUHlPMzJrOGJmbk4xRmF2WmdLX0lRWkhWNGZfaGJTYktZRXhZVzVreDVTTEtCaE9Ga2paUG5Bd2FfdTRTTHNCNDdmS1VkWG5JZjR4Q2drUFZ5dXVaQ0FQV0dycWhILVA0NDIwNXdYak9TdmVBTGFUc0VTWU1qVDhta19rMXNtb0RwUDlLenp4ZzdJQk1XbHlHSXNIbEVqMlpheGx0X2FRN1BhV0xFVlZ3Qld6Rmtjd0lWdnMwV0I?oc=5&hl=en-US&gl=US&ceid=US:en,InfoMoney,https://www.infomoney.com.br
"Na PetroRio, Tanure não tem medo do petróleo a US$50 - Brazil Journal","Na PetroRio, Tanure não tem medo do petróleo a US$50  Brazil Journal","Fri, 07 Aug 2015 07:00:00 GMT",https://news.google.com/rss/articles/CBMigwFBVV95cUxNcHhXOV9MQTE3bU1NVjc1ZzY4ZHBlVGNzRkRMaHpCVDBvemJTZ1JVVXRoczF0NzFTR3kyUEQ3clNmaW1iSWxyd0FxSGJzNDN6UWRldmU2UE1qSXcwWGhuaWt5RFB1TEhHbEZGdk05TWZDVkFKTlhTdVJVV2Q2clFoVk0tcw?oc=5&hl=en-US&gl=US&ceid=US:en,Brazil Journal,https://braziljournal.com
PETRORIO AMPLIA INVESTIMENTOS EM PRODUÇÃO E ESTUDA COMPRAR ATIVOS DA PETROBRÁS - Petronotícias,PETRORIO AMPLIA INVESTIMENTOS EM PRODUÇÃO E ESTUDA COMPRAR ATIVOS DA PETROBRÁS  Petronotícias,"Thu, 28 Jan 2016 08:00:00 GMT",https://news.google.com/rss/articles/CBMirAFBVV95cUxOb0xTdHh2TzN3RU9HQ0FwcVh6ZUNBcnFuZjFTaU1VTXA3Mm9hVFVYM0FBZWJTRGVNYms5dGFEdDd0ZWZ0LVJSWURlcEV4NVZRYjhUSWVjQWs0YjBjbnZzQi1UM3hsX2tma1RRMHBrM2xRbld3Nkt4ZURRNWw5aVhsY3FwNi1ZX1M3NW1jdnNNMENYZ1VYcnJNNThoT29wN0NSNjdIalViMlNxY1Jx?oc=5&hl=en-US&gl=US&ceid=US:en,Petronotícias,https://petronoticias.com.br
ROSNEFT PRETENDE PERFURAR AO MENOS SETE NOVOS POÇOS NA BACIA DO SOLIMÕES ATÉ 2019 - Petronotícias,ROSNEFT PRETENDE PERFURAR AO MENOS SETE NOVOS POÇOS NA BACIA DO SOLIMÕES ATÉ 2019  Petronotícias,"Mon, 29 Feb 2016 08:00:00 GMT",https://news.google.com/rss/articles/CBMisAFBVV95cUxOTWR2U0kzTlNaeVczSUIzX002NkY0R2VPN25NbF9zckpaZkFCeHRCRjhjQzVCNmVsOFBhVXppQjY5OTJMSlBOOHBrUHh0Z3FPQkJWNlRWRXZJbkM5S055YzNTa1lBTHpBX3ZnTVlncE81UERJaFdwMGtBX21ZeXlzRlhza0VaajZIQWRPSEw1ODdSNGpISXpWRkxHUXFPTmxLOFhpcG5TbTVtMHAxb1Fkcw?oc=5&hl=en-US&gl=US&ceid=US:en,Petronotícias,https://petronoticias.com.br
Maersk Oil fecha escritório no Brasil após deixar campo de Polvo - Valor Econômico,Maersk Oil fecha escritório no Brasil após deixar campo de Polvo  Valor Econômico,"Wed, 04 May 2016 07:00:00 GMT",https://news.google.com/rss/articles/CBMivwFBVV95cUxQUUY0RnFobkt4RW4xclROV0hFSEJyYVN1aDBiazNRa1FSblV5YXQ1VDlPa0piWGdHalVXUWVJVnFvbV9HQ21ETlBLeVZ1R2cwRWtPV25rUjZDYkdkMVFKWU5EOGctS1V1UThfS0x1LWRQS1NGdTFKZVFOQnhsc2xmZVA3T3JRaUhYUFFmU04xYllkV2lzdFU2S0tWdm9DYUJoc19QeG0wblA1X1N4QW5zMjZsZW12bkx6cHpOTGxxWdIBzgFBVV95cUxOMGxzQ0hCWEZhbmg4OEtYTllNNzhFSTNPaWNzbG1RTGl1YmFaR1NFWGpuSGp4Rk1wY3ZOY21tYTc4YzI5RmZRUks1NWZ3Mkp0a1FVemRQdXhHbEZwaGhSTFFVbTJmeUgxZXpMVVhCalljU1dOakFMYjlGWHBQc0x3YTRfei04RHlwQ2Y4RGE4UGhEMHE4dllaODNDcW5Bc1Q1cUI3Rl9yS3lmM21ic19pRnAxaTRmbzZyU2wxX0N2R1cxRzdvWUxyR3F4NGRiQQ?oc=5&hl=en-US&gl=US&ceid=US:en,Valor Econômico,https://valor.globo.com
Filme coloca Rodrigo Lombardi em plataforma de petróleo em alto mar - O Globo,Filme coloca Rodrigo Lombardi em plataforma de petróleo em alto mar  O Globo,"Tue, 24 May 2016 07:00:00 GMT",https://news.google.com/rss/articles/CBMitwFBVV95cUxNUnpjMWhXTGV0VTFuR2lTcXY1aFdXU0lsMzhvcE9HU09XcE1FRUZ5dkpBbWFHUXFOa25zbFUxSnVQam5UV0ZNbmVWaHdVVlptbDA2WEV3Z3V1aXVzSERWNV9TTFFreUdyN3VoMXRack9RV08ydTVpUUZtTE1zT3FGTmMwVktucEJnWVg1Sm5vNzhJNnJkWGdfcm1kd2UyVVhXaEh3TEI0X1hRemFULUNZR1lWdzltMHfSAcYBQVVfeXFMT2l5SlhhZ0huZjdLMFowTVJGRzQzTzZ1OGZqdzFfSG9NaWk4alNreUpSOGVOcnFaVGZoMDZlQWRVSnU5ZzhSal9sSmhqSmxVM09ZSm1UT1hBM2FINGVrb2lGUjJrcHg5ZXlRRDNxZURCV1l3OUdBb1ZZTzNod2NFeUVLeENQdC1sdC12SVlnNDN6NDlwam9Nd0dMX3dET3BfWmJrN28wWDZSZGRmOGFFUm9jSUk0aE1BNU00dnhyM2lFcG1IaklB?oc=5&hl=en-US&gl=US&ceid=US:en,O Globo,https://oglobo.globo.com
Tanure monta posição e quer novo conselho na Oi - Brazil Journal,Tanure monta posição e quer novo conselho na Oi  Brazil Journal,"Thu, 07 Jul 2016 07:00:00 GMT",https://news.google.com/rss/articles/CBMif0FVX3lxTE5wM1dhZk1rXzUxWjBla0NOcW8tVm9za1FlOURNU1VxeXY0RmV4OERiSmtVYnA3R3BWSW9Wc1RPZDVqRHhhcWRlaF90SmlObkRiVDBQOUIzNXdBay0zV0hMWjUyNkVvVzAzamxIajByUU1oSVA0Unl0eVh3TjctQ1U?oc=5&hl=en-US&gl=US&ceid=US:en,Brazil Journal,https://braziljournal.com
PETRORIO COMEMORA PRÊMIO INTERNACIONAL E ANO PRODUTIVO EM 2016 - Petronotícias,PETRORIO COMEMORA PRÊMIO INTERNACIONAL E ANO PRODUTIVO EM 2016  Petronotícias,"Fri, 14 Oct 2016 07:00:00 GMT",https://news.google.com/rss/articles/CBMilwFBVV95cUxNTUEtM2xEMjRoeXRWTDVnemJBMUt4YVNUbGl1SVZQWHc3LXdJYnVFclN0Wlp6azF3cnI0RWFpN2pmTUJ0bThEWGJHVW9nWXA5MWV0NE5XMlJONzhWTUhiWEVqazk2dnFMdnJISzlhMTlTYW9VTVFOV2tKWjhJVDZBamtxdHViS1FQNkc2Qzl4NGUwdk92OWdV?oc=5&hl=en-US&gl=US&ceid=US:en,Petronotícias,https://petronoticias.com.br
"PETRORIO MELHORA RESULTADOS OPERACIONAIS E REGISTRA LUCRO DE R$ 71,5 MILHÕES NO TRIMESTRE - Petronotícias","PETRORIO MELHORA RESULTADOS OPERACIONAIS E REGISTRA LUCRO DE R$ 71,5 MILHÕES NO TRIMESTRE  Petronotícias","Wed, 16 Nov 2016 08:00:00 GMT",https://news.google.com/rss/articles/CBMiuAFBVV95cUxONzhfaGJtdDNyQV9jTmdzWk9rQV9CbW8wNmxibVZVNHk2S2F5TzhfY2RxUW1RcHJMdXU4NDN4ZzZfUVg5YWZGQkhUM1dNdnAzLUYxVnRlZ1k4eUw4WXlNOE9jZERMYU5kMDZKU2hoUHliOUtuNHgyQk9CaERUVmpFMWpYUFd2Y0pMTVN4Y0pNZ25wS3NGajdmRWxva0oyXzBBOWo5Z2pnWUtXUHpTbzR5WmUzMVZUWG0t?oc=5&hl=en-US&gl=US&ceid=US:en,Petronotícias,https://petronoticias.com.br
Trader f1l1per. — Gráficos e ideias de trading — TradingView - TradingView,Trader f1l1per. — Gráficos e ideias de trading — TradingView  TradingView,"Fri, 11 Nov 2016 17:48:43 GMT",https://news.google.com/rss/articles/CBMiT0FVX3lxTE54ZjdYVFFRR1hTTU1qUXp3bU9PMUVvRXBJTTBHYnNzZ2lRUVBqaU9JcXZnVWhONW02b2xWUXJFY3pLYTd0TWppLVkwX1FfcHc?oc=5&hl=en-US&gl=US&ceid=US:en,TradingView,https://br.tradingview.com
"Aluguel completa 17ª queda mensal e acumula perda de 3,80% em 12 meses, diz FipeZap - ADVFN","Aluguel completa 17ª queda mensal e acumula perda de 3,80% em 12 meses, diz FipeZap  ADVFN","Thu, 17 Nov 2016 08:00:00 GMT",https://news.google.com/rss/articles/CBMiuAFBVV95cUxQWmRFMjFMaFVnNWdYUEdkOWp5RlBDYnloM3JndEVIZk1Cb2VPdzNLMnRMeGJPeGZjZ2hxb2J4bWo1YkhOQUM4cE5Ld0ZZT3l2a2RCSEhOQTkxdmdOc1ZMb0NkWndTVUhRQzlqRmZZNm5EMDkyNzJXVFBiSUJ4V01mOEdjUHJlX0FpUUt3OTBNczVSRnRXeVZoZzNJdzJyck1lc1lUTzU2Ri1wSnltYUNqZkhuQmc3YURu?oc=5&hl=en-US&gl=US&ceid=US:en,ADVFN,https://br.advfn.com
PETRORIO PLANEJA REPLICAR EXPERIÊNCIA DO CAMPO DE POLVO EM OUTRAS ÁREAS E TAMBÉM ESTUDA PROJETOS NO EXTERIOR - Petronotícias,PETRORIO PLANEJA REPLICAR EXPERIÊNCIA DO CAMPO DE POLVO EM OUTRAS ÁREAS E TAMBÉM ESTUDA PROJETOS NO EXTERIOR  Petronotícias,"Mon, 12 Dec 2016 08:00:00 GMT",https://news.google.com/rss/articles/CBMi1AFBVV95cUxQdkd6bFItQzRJQXpMRUcyUkZnV09ZazRSR3VZX2Y1LUQ2S0VDZGlvVE5wVFJ5TVh4aWpJb0swYzhfY0RndTR2M2s4RzJRQWpIeXdyaHpmVzE0RXVvRDVIbENJUXN5d1F1VU1yVHVYdE84SWFYX3BpM25vU3h1bzJVWHJtRFM4V08zQ2NBSk0zbVZ6TnVLazdHWW4wU2dsVUkwOXN1a21KNEkzbmIzREl2dHZneENxQ1dDWTJJNXV5RDlNQ1ZRT1RheFk0VF9wM204U0tscQ?oc=5&hl=en-US&gl=US&ceid=US:en,Petronotícias,https://petronoticias.com.br
Grupo RZO volta a ativa com show em Porto Alegre - Jornal do Comércio,Grupo RZO volta a ativa com show em Porto Alegre  Jornal do Comércio,"Thu, 22 Dec 2016 08:00:00 GMT",https://news.google.com/rss/articles/CBMiyAFBVV95cUxOR0l2cC1ocE1VNVZ5bVpIeUFGTUV4cEszcjg2NVB3bTVlMFRMWUlCR2tRd0NnY0tndUxQVGJwR3M0UU1kRHVqdnMyUy05VWZxUEJ4RnlRNGdEM0F0V05oVEJCNkxBVmw1T3pjOVVpNTJUYzk3dTViaGxRSkJUWjY4Zk9XazVmZWRKRGVxbGdDYXlvYmtBd2sxVDc4V05fYU53cHBXUHlsV1FKbnhkU3oxdEtGc3pmeGhwYnFnTHlJeXoyZ3g5YXBDdA?oc=5&hl=en-US&gl=US&ceid=US:en,Jornal do Comércio,https://www.jornaldocomercio.com
PetroRio anuncia acordo para comprar fatia adicional na Brasoil - Época Negócios,PetroRio anuncia acordo para comprar fatia adicional na Brasoil  Época Negócios,"Mon, 02 Jan 2017 08:00:00 GMT",https://news.google.com/rss/articles/CBMi1gFBVV95cUxPOWN0NV9URzhQMVc4WHRnc1U1RlVlMjJ0VTFHVWxMTjMtTzNpNlNNR0E2dGM1cWk1dkg3VGtyZ2FsczVsWmVSRHhiN0l6WnZqSmJZSFRTQXlla3oxUVZ3dmgydDhrNXZ2UUI0Wk9SMnQzcDdJWnByWE4xR0dyd2dueGtKMXpKYlpTcVd2XzlKMjZQeDFGbVFxVzE2MEVadVRrUU5xbUxaMkROd1A0R1JKTnhkbG9FdDFuSkx3YVZ2NnBkSWFGT0JyeFBXU3lWQl9OOW1RMHdn0gHbAUFVX3lxTE1fSXBWakFvMkZkeXhKWlU4a2c3UEFFWWtyUTFkVkZVc3N4UDdlVlkzZFdJZFZxTjBJRjFMQm9TYXZUSkNNSGlZcUNFR0hPaW9JUTRQSkpJYVNjTC0wWm1TcFo4STdWQXZYWG0wTGRCdzRDcllPbXB2eTlkTEpIMzQ5aEpFY3R2cW5TeEtFWDY4QnlwNmVpbFhiMXBCYVpnVDdwcnJqT3VzdDQ2M0dHRkltUWowazhDQWVTZkJjNnMxLUJzN2JQR1dkRklvbmxsQVI4LUYxS1A1MXdBVQ?oc=5&hl=en-US&gl=US&ceid=US:en,Época Negócios,https://epocanegocios.globo.com
Petroleira russa inicia perfuração de poço no Amazonas - Época Negócios,Petroleira russa inicia perfuração de poço no Amazonas  Época Negócios,"Tue, 21 Feb 2017 08:00:00 GMT",https://news.google.com/rss/articles/CBMitgFBVV95cUxPejFzWWxtaVNCYUZORGQ4Zzd0NmlrbTRObW9LdUZIY3VOb3hpaGt4NWNKRlBJSnh1M1NPa3NvVF82M2h1alc1cGFmUV93bVJycm0tSTRrdjVfX1FCXzFxamlid05FWjNKVmpGalJ3QjI2cW9oTDY2TGl5LWIyZUIxRHR4NEloWHFJRnZBLXRWTWM0YVlHSlhhM0pDbG1BWjNqQzRmalp2c1ZiZldwZmMxcUNMOU5YZ9IBuwFBVV95cUxNRVVWd1BtS3dTX09ES2t4SzJEcU96UTJCc0ROSVdHVGZydmE0c2phLWxJaE9vaUJ2a1RfZ2szR1ZqU3hiakUtdXE2YnhLdDU2REcwOTZjaUVRaUtXOW1La0d4am9CcU9ycjJKaU81UC14cTV4LWNidHFUSXMtVVlVMmJCbVBfYl9lNUpqQ3dNNEp6dkJGQm82ajNLRlg2MGtQYlpKRXA4Q0RDME5xSlF2U3h6OXFLN2lQUTFj?oc=5&hl=en-US&gl=US&ceid=US:en,Época Negócios,https://epocanegocios.globo.com
IBM - Buffett's Berkshire Hathaway Cuts Stake in IBM by Third -- 2nd Update - ADVFN,IBM - Buffett's Berkshire Hathaway Cuts Stake in IBM by Third -- 2nd Update  ADVFN,"Fri, 05 May 2017 07:00:00 GMT",https://news.google.com/rss/articles/CBMizAFBVV95cUxPTWVOc0ZCbmh5em1ueDdtYkhRRDhYQk1fRElockVBLUJWRXZFWVhlYS05VXhqZWpCTjVLRjNUbk42ZF9tRzljNHFRZGRBMXpFNjdmS0R0dWVzWWkyZTBuNVhUTzgydmZYZ01hRDgwYnNSNlRmZVhrd3VmUUZhR3VrQ1E5R2lMRUcwTDBUUElkYU1WanYwQ1VXYmpMNzRreWJXUVZtMkhySUtBMDlXN08zS3psQ3ZWMlpRX3ZiakhxcERyTnNDR2hqRTRGcjY?oc=5&hl=en-US&gl=US&ceid=US:en,ADVFN,https://br.advfn.com
"Tanure, da Oi: “minha parte não está à venda” - Exame","Tanure, da Oi: “minha parte não está à venda”  Exame","Thu, 01 Jun 2017 07:00:00 GMT",https://news.google.com/rss/articles/CBMieEFVX3lxTE82Umt2cDVfV21RbDFNZ1NtZ3R5Q2loYkFjX05VR0dJX1BsMDhJcGRjMWpXaTRxNS1KQWczNDFCbkUtUDdWUVQyNkFzUGN2QUZ3QU5HSU1PNlJjN083NzF2TjNpZGVPNThiZmVuSy1mOElpSlR2dS11TdIBfkFVX3lxTE5xdjZaRElvOXplSm5wTjlOMFdwbjZza0Ywb3UwWUNVREEwb3FTMG1IQVppUFN5S21nRERSeTZ5eFRZNUlmNS1wMkZGV0NPc3M2dXc1LWhCOGJiWEtlQ2lfcGFUQTZkZldKaHE2UnFVSDZRQUFaeVJFY01oRUFHZw?oc=5&hl=en-US&gl=US&ceid=US:en,Exame,https://exame.com
Diretor de petrolífera que já subiu 100% este ano diz que ações estão baratas e podem subir ainda mais - InfoMoney,Diretor de petrolífera que já subiu 100% este ano diz que ações estão baratas e podem subir ainda mais  InfoMoney,"Fri, 18 Aug 2017 07:00:00 GMT",https://news.google.com/rss/articles/CBMi1wFBVV95cUxNQWFQLUFYeWV4RnFuMWVGUENYZTRhRU9ZR2V1SlgzSFdZWEJjUnRUbEJFRGNBMjU4aU12cWxEbjZ1M0kyTjVKVkt2SVdQcW1heFNWZjFOeFJlNW5sWjI5bmZMQjNPR3dUV2tWRkYzOVphMG9lejVvWkQ4Qk1DbEUtUjlBZUdPRDJHRzQ0NUlrZl9Na3lHQkU1X0syTTRaTG10Zk5sbVZ5a1FJWEw5MG4tTnQyT19vWTZybUlPd1Nja2NtYmZvZnE3Y21uWkNoOTVsaFF3ZE5uZ9IB3AFBVV95cUxOcG9YNUVNWElTWVRTQmd4QnBuMmFxQ1ctOUNYNTdrNzdJRDctVUVFb0NtWmxlbG5tdlNJVDVzQlJiVERVWHZGTktrdGNCZXlJWmtXMzlfWjZvOEVfTGdRVWtBV3J4XzdIWEhuajJPVkxkOHdISVBsdTd3SXBiaERTZWZIZ3Q0V3dpc3BxTHRYSWZJZDl1WDdETVpBNkFDdlFKRVRZR2V5V2xwd1hpYmx0aUpDTXpla1RNVUVtenNPSHdxOGNrdHByOEpOVU8zNzR0WVoxM2tnZk8zN1d5?oc=5&hl=en-US&gl=US&ceid=US:en,InfoMoney,https://www.infomoney.com.br
Denúncia envolve filho de Moreira Franco e R$ 200 milhões de propina - R7,Denúncia envolve filho de Moreira Franco e R$ 200 milhões de propina  R7,"Wed, 25 Oct 2017 07:00:00 GMT",https://news.google.com/rss/articles/CBMirAFBVV95cUxOMXl5ZTJZNHZUM0Fubi1vSEZIZHRoUnBtTGNNN2pxNHF2cVpZLW56akVNUHB0bnB6bGtJLW9mN3lBeWQ1TWE5SDg2cHZSaS1CVlpmcENJTUVsdGFGeWZDSEFQRHJmWGJwWFVIejRGY1JKR01BQktPVHktRGR3MVd3cVhDa1FsNEY5N3V0bFcyMmRab1E1aTlrR1N1bXU2dFlBamM4NmVjeXlHT1ZP?oc=5&hl=en-US&gl=US&ceid=US:en,R7,https://noticias.r7.com
Nelson Tanure é alvo de investigação do Ministério Público Federal - O Globo,Nelson Tanure é alvo de investigação do Ministério Público Federal  O Globo,"Mon, 27 Nov 2017 08:00:00 GMT",https://news.google.com/rss/articles/CBMiqwFBVV95cUxNZzd1OGJwWUc5alBnYnY3WGg0WVFTWTdPLWNnclVkQ0h1aDk3SWxKRk9qaEEtUnYxdVJGN1FxTmVqa1pTQktMMXpFNlFMTFU4SUoxZEZ0YUV3Z1VpRDFYUWlvN3lTRUlXOUdJOHhOQlEtcmdHZGNwMDRrQ2xPZ2puRC1uZGkwNE9TemUxQlJjR0ZqSDJydWU1TnZ6RFg0UkxFMm85UlpiNlRUcE3SAboBQVVfeXFMUFB6Z3ZMYWZTRlBfNF8yanJjNHlHSUgzTzNtMUstdk1mOFpsUEk2eHJtMnZwb1ROakowNXVLR3hGdkJKVFZoR3hsckQxbkhDSUcxU0YxMkdPVUtuenFzaXFNVGtlNFNfYXVhUTVXRHB3LVpaUXZfbmdPX1c5ZjJZb1RyZ19zSkpISXpWMTYySFZjbjV4ZDZRdXVPTk9xdjdhSlJJV0poY2FDS1RtWF85Q3ljcGVJdGxQeTBR?oc=5&hl=en-US&gl=US&ceid=US:en,O Globo,https://oglobo.globo.com
Conselheiros da Oi são processados pela Comissão de Valores Mobiliários - Jornal O Sul - Jornal O Sul,Conselheiros da Oi são processados pela Comissão de Valores Mobiliários - Jornal O Sul  Jornal O Sul,"Sun, 05 Nov 2017 07:00:00 GMT",https://news.google.com/rss/articles/CBMiogFBVV95cUxQSlB4WGVLWllSTDVhV2E5bGgyQVdyM2V3VHI4R21kaFhzYTh3VmRuNzdpQ1V2RkJnS3poeXZNdFF4ZGNod0FpQjJTcHRBa2pOeUFabldMUERpOUsxUnpkWk5mRFUwNzV1elAwWVI1UUNEdUotV29qUmFJRGplR190TzRvUWtlNm1SU3NXaTZHbmNYdWpraGlMZjEzd29LclBmQ1HSAaIBQVVfeXFMUEpQeFhlS1pZUkw1YVdhOWxoMkFXcjNld1RyOEdtZGhYc2E4d1Zkbjc3aUNVdkZCZ0t6aHl2TXRReGRjaHdBaUIyU3B0QWtqTnlBWm5XTFBEaTlLMVJ6ZFpOZkRVMDc1dXpQMFlSNVFDRHVKLVdvalJhSURqZUdfdE80b1FrZTZtUlNzV2k2R25jWHVqa2hpTGYxM3dvS3JQZkNR?oc=5&hl=en-US&gl=US&ceid=US:en,Jornal O Sul,https://www.osul.com.br
FPSO da BW Offshore tem mais um ano no campo de Polvo - eixos,FPSO da BW Offshore tem mais um ano no campo de Polvo  eixos,"Mon, 08 Jan 2018 08:00:00 GMT",https://news.google.com/rss/articles/CBMiiwFBVV95cUxPdXAtMEszay1xT1hTcjlTekFtLTRodEtkdUs2UUJhaGRFT0dGWUhmRE5VemZUOWhmcUVhWi1SV3dkUlFBQi1BQnpXR0M4akx0RFJPOVJVZHQwVWtqSlVZS0ZIVDA2TXU2VjR6d2pSaFN5R2V6bVF0OWY3c0xrUVc1dnhYZ3VKbmlsYWhv?oc=5&hl=en-US&gl=US&ceid=US:en,eixos,https://eixos.com.br
"Genial: Small caps, micro caps, blue chips e dividendos, o que comprar em fevereiro? - Money Times","Genial: Small caps, micro caps, blue chips e dividendos, o que comprar em fevereiro?  Money Times","Wed, 31 Jan 2018 08:00:00 GMT",https://news.google.com/rss/articles/CBMirwFBVV95cUxNWDY1UVVDWVBOWmdFNGpfNUNrZk1TbU1hSzdVdFlsTVg3WkhISGdYSmFYR3gwZF9YZ0swQ0ZvMnAySjBOQUwzc3h0Y18wenVmMHVQYUI4SWZjSEkyUm9rajlTd2tuZDg0UHRzZDRUelAwcGRjT3RTQWNwRUdOV0tGZHVaM2pzMWdZTFUtZks2ZDcxaDVYY2c4c3lkaEFiWGw5T2pwQkMwaGoteGMtLXJF0gG0AUFVX3lxTE9RUUtXd0psaWFTOWJuYVhxdG85a1Z3emlYTlJsa1dJSWJiNkpCTHpialpwYXNIUlRNek5wN25ldDZPbnc0U2ZqY1RqVWtkVHBPWU5ZTFpCNTFZQVZhdVRGdVVROU9KSF8xV0hvTFdKSFRNUTNMazNoNEcwaEp4eGdwX0haSXZoZWNveXdNUzFlYjJ2Yk10aUdYMnpOVG1QMk83SHRDRkFfMzdXVmpmSUVKTnlyUg?oc=5&hl=en-US&gl=US&ceid=US:en,Money Times,https://www.moneytimes.com.br
Petrobras perde espaço na produção nacional e dá lugar às estrangeiras - vermelho.org.br,Petrobras perde espaço na produção nacional e dá lugar às estrangeiras  vermelho.org.br,"Fri, 09 Feb 2018 08:00:00 GMT",https://news.google.com/rss/articles/CBMiqgFBVV95cUxQYVhYOVVVQ0dfZG55bDZzajBlUXdmUTl5U1l4WktPb2YzYzlmTk5zbF9JZWNwcVlKTWY5aldoQ20tU25ERVppNU1tWm5BbjdlLVR0WVVFMDRfLWpwX1JZM0UyVGFnTERGQ2dOTmtmX1E0Rm1CbGowTHV0S1Znd0xRQlVtVTRVS3VTSWtmT1JkNFVNMEpOQ19pZUtfWHpFQi1RZFhOa2FXTW5CUQ?oc=5&hl=en-US&gl=US&ceid=US:en,vermelho.org.br,https://vermelho.org.br
22 ações da bolsa brasileira tiveram valorização superior a 100% em 2017 - André Bona,22 ações da bolsa brasileira tiveram valorização superior a 100% em 2017  André Bona,"Thu, 01 Mar 2018 08:00:00 GMT",https://news.google.com/rss/articles/CBMingFBVV95cUxOTzJveEtTY3oydmxGblJLY1Z6Sm1icmF3dzBSRXJ6MzhmNXpHa3NrbVFPMkJkNzJBRHhicFl5ZktmM29EeVRqTkJvUHMtWGJ6MGg4VFR1dmxxdExhcnlDc21hRmtfVWp2VVgwT0EyQUNuS2JGNEhlNWpPSG8tcWRYcDF2c2RoaUFKbEdGNk9ndk9GUmZVZzQyTDNRLW0xUQ?oc=5&hl=en-US&gl=US&ceid=US:en,André Bona,https://andrebona.com.br
Justiça suspende direitos de acionistas da Oi contrários a plano - Exame,Justiça suspende direitos de acionistas da Oi contrários a plano  Exame,"Wed, 07 Mar 2018 08:00:00 GMT",https://news.google.com/rss/articles/CBMilwFBVV95cUxNRVpndndaeXY1OE5qQk1VV1hPNXAxQ1FlVXB3V0otb2U5UVJTQk44MVlYS2VoTTRjTUxMS3BBUl9qVm5UOGtxMmRoOWsxUnRjNzBWc25WUjdyejRwWEJsNXZiRXJpcWQwdHBfblIwRUpsMXczT2E2VmpSdHhLQXR4RzVFam5BZFBKc1FWNWdSQ2s1RU9MU2JR0gGcAUFVX3lxTE5wQ1ZsTGNBNFFPZVV1bElPQ0dDaEo1TFlQWHNDdXR1WGhaUURTUTVHX3pENkk4eGpia1VyUXNGSHZYR2t1bjRNSWFpZklhU01SRVNWZ054QnZqVGYzZmdaUlJ0QlNoaTZMWm45RDRsRFZfdUtCOVU0anZoaTFNemc5WVdROHE5NWRnMkpGRFRNT0VlTjhrNEpTc1lFRw?oc=5&hl=en-US&gl=US&ceid=US:en,Exame,https://exame.com
PetroRio anunciou investimento de cerca de US$ 50 milhões no Campo de Polvo - Jornal do Comércio,PetroRio anunciou investimento de cerca de US$ 50 milhões no Campo de Polvo  Jornal do Comércio,"Fri, 06 Apr 2018 07:00:00 GMT",https://news.google.com/rss/articles/CBMi3wFBVV95cUxOaV9UWEhITF9Bd1UtMWcwNjgzbW0wSjBjclJfX1Z6Tm1oRld0RllLcWJjN2QxSUR0NHhoRTFRQWI2ZzhBWEdPN00xLWZMS0pzRFNrYU9CYVZmVVBlMlBQQjktOE1fQUlJMi1iTjhpQWQ2eWxxZEhaRE1oNjVFZVFhanRqX2VpMmZxaHdMd2FoVkZwNHpFTG9ueVpzV2tMVnFfWndzNloyNHphZ3B3dEh5VmZRLUotTjJWZk1sN1VVTHU0aS1nc3haQVVUWFZ2a0ZPUkJmaE9ONS04WDNOaWtR?oc=5&hl=en-US&gl=US&ceid=US:en,Jornal do Comércio,https://www.jornaldocomercio.com
PETRORIO COMEÇA PRODUÇÃO DO PRIMEIRO POÇO DO CAMPO DE POLVO - Petronotícias,PETRORIO COMEÇA PRODUÇÃO DO PRIMEIRO POÇO DO CAMPO DE POLVO  Petronotícias,"Tue, 29 May 2018 07:00:00 GMT",https://news.google.com/rss/articles/CBMikwFBVV95cUxNZjA2RGg5dFpXLXd6NXY0amxwUUk4RnBDVUNMa0EwRFV3b044YWJiYWwzbnRnQmlkQTl1QVN1VHBkNjM0VkpENmNac1JhRllqNTI5TzdraFdmRlZQLTZxQmlGR1ZfQ1htbW0zcHdxT0hVUjZnYXVSMjBmTHpZSDVCdE5EN2YzeDUyRWZVbHdhY19Ka2s?oc=5&hl=en-US&gl=US&ceid=US:en,Petronotícias,https://petronoticias.com.br
"Dasa (DASA3) encerrou 1º trimestre de 2018 com lucro, receita, ativo e patrimônio crescentes - ADVFN","Dasa (DASA3) encerrou 1º trimestre de 2018 com lucro, receita, ativo e patrimônio crescentes  ADVFN","Wed, 16 May 2018 07:00:00 GMT",https://news.google.com/rss/articles/CBMiwgFBVV95cUxNTDhrMzZVLUtSNThXdVU2M0FmY0VlNGJ5UFB1Z1BDeXpyUDc0R0lRNUhHX21ldEFRenlkTjF3d1hPNlBQVC1NVlplb1QtbUF1TFR5bTdDb0h5V1hiTW5ndVpLRmY0aUtyTU5meVFyUmdmb3hhNE9FZ29SNS10MUZIa0xXMlFzd2N3NjhIZS1mcThjOE1GdnFkaHZmM2E5enVfeUM5WjZMYVlZQzhlTmhubFNCWU11MXktRkl4N0QxUnVNQQ?oc=5&hl=en-US&gl=US&ceid=US:en,ADVFN,https://br.advfn.com
Petro Rio inicia produção de segundo poço e a perfuração de terceiro - Money Times,Petro Rio inicia produção de segundo poço e a perfuração de terceiro  Money Times,"Tue, 31 Jul 2018 07:00:00 GMT",https://news.google.com/rss/articles/CBMiqgFBVV95cUxONkNMUHBtdDRPMmx0Ny0tdm90akJYVXdQcS00UW03eVBBaUhUS1JyOVVRRTJBWVBjZ0dPWm0wMEdqX2RTakVLYjJ0bnprWDVpQzZPd25LNm9aOE5hUGYyRmUwTXQ1OEFFQnFPaWM4Q1Q2eEZ0NHJkdFFpZ0VjS05ndnVXb0RLZmo0b2NQOHlSTjF3TF93YkhPZm1JV3VGVTAtclFDWk5SMkozUdIBrwFBVV95cUxPZjNIYWRtekRvcldBdHJwcGwxMGU2YVpueFR3NnlyZU54RTBrMVZOZ1p5OWlrTXQ4YlpfMzNmcVd6Mmk2RVpiM0Voc2V0T2JGVVZaSU1VVzJJdDRWUUo1ZFZFV01Mdm5WTXpQRWx6bWNlZHloLTA3QnV6cWxhZ2tKd3BOSllYUFVPMkNRdGQ0TG9IQVhZX2dGdHJ1ZUFRSGNWMk11dFpENW1xV3VrMVp3?oc=5&hl=en-US&gl=US&ceid=US:en,Money Times,https://www.moneytimes.com.br
A desenganada HRT virou a promissora PetroRio - Exame,A desenganada HRT virou a promissora PetroRio  Exame,"Thu, 02 Aug 2018 07:00:00 GMT",https://news.google.com/rss/articles/CBMia0FVX3lxTFAyckg0VEJpZlpQeGIyc3FmV1BTSG9scGxfRFZoZnRJZlBBR1ZsTDVQR1h6RTZNeURZa21teHhsTlVWazVlM3RNMTVpQjc3MU1pYXk5Y3FxY013ajFra3dSNHhUdUFqYTUtams4?oc=5&hl=en-US&gl=US&ceid=US:en,Exame,https://exame.com
Pesquisa Marinha e Pesqueira - Fundo Brasileiro para a Biodiversidade - FUNBIO,Pesquisa Marinha e Pesqueira - Fundo Brasileiro para a Biodiversidade  FUNBIO,"Tue, 25 Sep 2018 01:35:03 GMT",https://news.google.com/rss/articles/CBMihwFBVV95cUxQY3BCdGJzdm1ZLXFVUkxNb2hQV0hXbUxfWTh0T0xGUDlrbXpXTERJUGlDS1ljNUVyOGtSWk5wMUhQOGFKSnVXaklFcm1UX3l0aF80Z3l5ZGJIbHhUemd4Umk4QktNRXVSQkNvRE5mbUpOM3E0dFBmemhtNzB4R0xsQnBhdXNsbEU?oc=5&hl=en-US&gl=US&ceid=US:en,FUNBIO,https://www.funbio.org.br
Petrobras licencia quatro novos poços em águas rasas na Bahia - Ilhéus Net,Petrobras licencia quatro novos poços em águas rasas na Bahia  Ilhéus Net,"Tue, 18 Sep 2018 07:00:00 GMT",https://news.google.com/rss/articles/CBMingFBVV95cUxPSDhNNlp0SWVWSklKdW9Lb2lsSWpfMGRWeGVpMTVaeEtpd0stbjdpVm9SUkY5WFJjMUJkUjc1RnRaYUtBQW0wbjJQa0I0SGprc0ZhZ2tyTmdZakdMdndOdlFpVW04WWo2bk5CamhpaTBkakhvLXA5ekJJSlk2S1R2bEFxZ2txNHlzajBydVpYUVlPTWtBRDNGZ0lTa2p4QQ?oc=5&hl=en-US&gl=US&ceid=US:en,Ilhéus Net,https://www.ilheus.net
PETRORIO ALCANÇA LUCRO RECORDE NO TERCEIRO TRIMESTRE - Petronotícias,PETRORIO ALCANÇA LUCRO RECORDE NO TERCEIRO TRIMESTRE  Petronotícias,"Wed, 31 Oct 2018 07:00:00 GMT",https://news.google.com/rss/articles/CBMiigFBVV95cUxPNGdtQ3JZSU1kREpGNm9aZkZkNjJ3M25lT0VILWxsVGF4WGxFbEFvM3AzYzQwenBNZmpIZS1LUmwyME9wX29PYVhndk5JR19yeVN2NWFHMVAyYmRENGZDU3dJWFNZeXBCelFvcW9neFhhXzY1aEI0WXlEbGRuSVNtZDJkV0tKLV9DbEE?oc=5&hl=en-US&gl=US&ceid=US:en,Petronotícias,https://petronoticias.com.br
"CEO E&P 002: ""Queremos ser a maior petroleira independente do Brasil"", diz Nelson Tanure, da Petrorio - eixos","CEO E&P 002: ""Queremos ser a maior petroleira independente do Brasil"", diz Nelson Tanure, da Petrorio  eixos","Tue, 16 Oct 2018 07:00:00 GMT",https://news.google.com/rss/articles/CBMi1wFBVV95cUxNZEc1RVVUZ19nTmVqeWxqOTVfVFg4ZDFtNGhQSnU1N29GYlA1bUxqN2RDS3gyakt2dUp6dnBNcEdXRHpFM1EwMldqVk5jYkVUQm52M0xkQi1oWkJ4Zmdva2ZDQTd5d3lEMzhvdnpDOC05WkRjbVpfZ19VV1lmWjFxVUs1dVBBbXMwN0JVZWxDc3VjbHFlS2xPVy0waDdNckNKRFd6TjRiNE44aGNhZUhUYUdzLXNnTWd5dVBFaGhfUXUzd1ZRMV96cEk5NU1mV3BzcHE1SVJMaw?oc=5&hl=en-US&gl=US&ceid=US:en,eixos,https://eixos.com.br
"Petro Rio assina compra da Frade Japão, que detém fatia no Campo de Frade - Exame","Petro Rio assina compra da Frade Japão, que detém fatia no Campo de Frade  Exame","Mon, 29 Oct 2018 07:00:00 GMT",https://news.google.com/rss/articles/CBMiogFBVV95cUxNVDk3OFliVGMxM2NmTG9OeHliYmVhdk16QmdlZ1JWUEVZM1FJSklIby1CSlh2TkxJUHhaRXV6SDFUZFNXRmhjOGxHY3A2WDBybVAzallnbktoX1VyTUlSTHR4QTB4cmR3ZWl1b042bGZNaUxnYmQ1U2EtbFJlU3ZZWkoxOXE5LUVFTFhYamZWUzVjbUNtdGxKOGM3TFNIaE5pU3fSAacBQVVfeXFMTjU2cTItT29ZTHpMaHVYcDZSVThZUm42eEdPZzBIVDB6cVZHSXZyaEsxX2dMWHlTSjd0NHp2YWx3dTBrZ0pBejh4eUxNbjQ3eDhDdW5yQThzcE9RWTZWbEZkVWZrNXlJUW1RakpTVVRiRS0tWkVrLU84ZkExc0pxUWhXU1NISWlyTWl4NUh6NVpHQU8tSV9HRVc4QzFWQ3QtREJON0RuYm8?oc=5&hl=en-US&gl=US&ceid=US:en,Exame,https://exame.com
Teatro das Artes chega aos 20 anos rebatizado e com nova programação - O Globo,Teatro das Artes chega aos 20 anos rebatizado e com nova programação  O Globo,"Mon, 24 Dec 2018 08:00:00 GMT",https://news.google.com/rss/articles/CBMisgFBVV95cUxNaDU3TXBYelo2akliSUVILW1HSC10cVBBaEYtdVFIdlZTNWtFdTRVdHNiV243R2NqY3h6MHpBaHppeElGSWhlc0pDYy1ZdUV0Um5NRlo4d0xrQi0ycGJzaTMzSl9TV1J2N2VKTHB1NWhvZE51bzZNbW5XWlRraVNjSzFJWG40RTdVdW05bXVlWGJxTklmbjNCbnI4NE9IMm5oWDA0UFJ0bnZIVmpFUUtMNnp30gHAAUFVX3lxTE5MU0dHWFRBSVVoX0gwM0ZuSXpKUE1nVi1UT0VNVlVocjJsSVd3c05CYzFCVDFkQVE3dzQzSlJGUWVNa1dheXhLLVJrd1J1c0pIcTNBSl9EWVN1cXhqN0daMkpWajhDemVQRjhkdkx3azB3QTdWakxZaFU1ZGNNalhlSnpCNXZ4UkRQQm9xZGQ2aWg5ZEtLYTgzNk9wYWgyRU1ZUjFZSURWVl9mZ3FtRGRGdEc3bHFtVndSbHVrVklqNg?oc=5&hl=en-US&gl=US&ceid=US:en,O Globo,https://oglobo.globo.com
Quatro gigantes do comércio petroleiro entram na mira da Lava Jato - Exame,Quatro gigantes do comércio petroleiro entram na mira da Lava Jato  Exame,"Thu, 13 Dec 2018 08:00:00 GMT",https://news.google.com/rss/articles/CBMimgFBVV95cUxNcDNadUtRMk9KOWpwRFhSYWJkY1p6dU9FSUJiU2Vwb015eGNfQkJLNEg1RVVVUUZqNnlONFJYTzE2TmhrUUFXUUF3Nkc0NWJCNUdwZmlzT1VEclZHczVXeEUzRmJOMFVYekxxSWItNmxESlp1X24xMGFTRWNjZk9SY3hmWFVSalR3bTcxX3d4Sl9mbldkWU5IRkh30gGfAUFVX3lxTFBCTXRMUmNrbHZYN29qRVJDT1lKMEVqNm5FMEotZXN0V2tmTTR0eGJDeGpHSXlWR2FmOVlVVEZfcVNtUVJMd2NFWEFWSFRfUzgzR29MQXJwVnU4a1NUUjdFVTZDck1UbTlfMW5YeHlmbjhsSzlwTkJNYkxjUFFlTXQ4aVQ4WHNyMnM2RDRnQVZGcUFXbmZqOWhCd05naVVWRQ?oc=5&hl=en-US&gl=US&ceid=US:en,Exame,https://exame.com
Marina Ruy Barbosa homenageia Fernanda Montenegro: 'Fonte de luz' - Terra,Marina Ruy Barbosa homenageia Fernanda Montenegro: 'Fonte de luz'  Terra,"Sun, 16 Dec 2018 08:00:00 GMT",https://news.google.com/rss/articles/CBMi4gFBVV95cUxOZGY1aGs4RHQtR3o2SzJzd3hPMDQ4b0t6a2o2d2pzY2d6b0JUZmU0SlJFaHRmdkN6d3k2eEpmVV9zRXRGRFowRVlzeDUxNzZLbmlGQTFhbHduUkxua3dya3M3WDVWOVBfc05fZWxxR2pZSUZWQi04WjBmT2ZyNHRpcXRHQ2RZLVVUb19XbU05ZUQ2VXFzWUFEZmJsSFJBX3g2RDVrdzhTdkN0MFZ4RUw3WExMdXhuS2RhbmdXLTN6X0ZfMG9La1c5TVp5cUtIcWp6clJ5ZElQUGduM3VacFpsaFZR?oc=5&hl=en-US&gl=US&ceid=US:en,Terra,https://www.terra.com.br
