title,description,published date,url,publisher_title,publisher_href
Rede D'Or adquire 100% do Hospital Santa Isabel pelo valor de R$ 280 milhões - ADVFN,Rede D'Or adquire 100% do Hospital Santa Isabel pelo valor de R$ 280 milhões  ADVFN,"Thu, 28 Oct 2021 07:00:00 GMT",https://news.google.com/rss/articles/CBMirwFBVV95cUxNc25oaVpiMm9XdFV3YlhxWGFkZno1M3lTTGhaRmZiZUF4V0VYUFE4NUwxSV9mSlVpVkI4dUctdS03dzN5LWFNWXZyeWpYaGN5Ykl0OC1ZaDFMVEpNenRtVjQ4dWQwdWRfZC1oNTQ2bm5KV3Ywa1ljeV9DNUVocm5nWHk2TTNTT3ZfTWJUVERMS0RNOG1NS0ZPdDFRRWhFcDVGVEl3b0xTbHVCUEJRMHdB?oc=5&hl=en-US&gl=US&ceid=US:en,ADVFN,https://br.advfn.com
PETROBRÁS RETOMA PRODUÇÃO DO CAMPO DE MANATI - Petronotícias,PETROBRÁS RETOMA PRODUÇÃO DO CAMPO DE MANATI  Petronotícias,"Mon, 04 Oct 2021 07:00:00 GMT",https://news.google.com/rss/articles/CBMif0FVX3lxTE9SYVJoRlM4Vlptb1ktX1VsY1hHMmdfQVJ1a0oyQXRJUklSWjFOQ3RuZng2UVFwZTNfY3RqRkhvLU50MWtWRDNJY3Y2bHRnaGFyWHRBc2NPTTFicW5SRmRMblQ4bF9OeWEwZHRaVndfN2J2Ui1xbjNRdDJBcTB2TGM?oc=5&hl=en-US&gl=US&ceid=US:en,Petronotícias,https://petronoticias.com.br
"PetroRio (PRIO3) salta 17,9% com consórcios escolhidos para negociar Albacora: por que operação é tão positiva para ação? - InfoMoney","PetroRio (PRIO3) salta 17,9% com consórcios escolhidos para negociar Albacora: por que operação é tão positiva para ação?  InfoMoney","Fri, 05 Nov 2021 07:00:00 GMT",https://news.google.com/rss/articles/CBMi6AFBVV95cUxQb1VmT1pHRGdOeUU4QVB3SmRzQkNPYUpRc21qSklyS01sdWhVaUtvcmk1Y0lKRnRvZzNBa3d2OFdWZDlqQms5WGZ6c3AzdEVNNEtZNjFVUmp6WEMtSGdVdUEyYXBzUmMxRnJkdGhaak4xMU5LUFlZczJNMF9JZnNWYzhuUm9jNHMwOHU3bUlKbi0zUDR1RkFHSGF2UFRxbi14U2pwSGxnVTB1cmkxUXVGV2x1X3FlancxWWtUaEtlajJPck9KTTlhd2t4YndDX0dCZ0VVSGo0ek0zaHhNcTQzWC1NVGRzcXNS0gHuAUFVX3lxTE1iTmgzVEIzclhUSEd5TzRfOFV1a1d0NlJxb0duOGM2VHNpRDRTb0MzNmJoWDNUbmVfYXdkLU9GV3N1TXF5MzZwdmNQNFg2WGZ0bXB3bDJvRDZNemxxSWVHN2U5TnlVa0d1S1IwcjNuS0NNNmdfOFE5QWg4WlB0alB0RFlCUDFqMnVBOGlyaHZ4Z1R1Ri1STkVpY2l3RzhVOWwyRlNEeWFwZjlGd2NnVFU5Q1c4bmt6cWRwN0JaWE1xQVYteXBLV2EtWXY1aXAxejJuUXlKTTZTZnI4LWg1cldka0laQjNEa1duUEhfcWc?oc=5&hl=en-US&gl=US&ceid=US:en,InfoMoney,https://www.infomoney.com.br
Ações da PetroRio (PRIO3) dobram de preço em um ano; quais fatores levam à alta? - trademap.com.br,Ações da PetroRio (PRIO3) dobram de preço em um ano; quais fatores levam à alta?  trademap.com.br,"Fri, 26 Nov 2021 08:00:00 GMT",https://news.google.com/rss/articles/CBMisAFBVV95cUxPZ0tQajIwWnctRjIzS2N4a3Y3eVdNbzVnY2pFWjFENGJfVjJKbTluZnptMmROMkVtUjFHWTNQZlAyWUo1ejRFSzFYdFlPMHZvMlpEXzlNMW9RYWl4bjNVWHdyaHdOdEU5THo1V1hoUng0TUdJdDFyTXJsOExKcmJCZFRjQ2x1akVVY2FoUVVkaFdXeXdvMTNVS2V2LU9MZnFTTDJucXRpZThpNEdBTDkzTA?oc=5&hl=en-US&gl=US&ceid=US:en,trademap.com.br,https://trademap.com.br
PetroRio (PRIO3) dispara 18% com potencial compra de Albacora da Petrobras (PETR4) - suno.com.br,PetroRio (PRIO3) dispara 18% com potencial compra de Albacora da Petrobras (PETR4)  suno.com.br,"Fri, 05 Nov 2021 07:00:00 GMT",https://news.google.com/rss/articles/CBMirAFBVV95cUxNZmdqbTJycVpKNmZ2OUNwT2hBbnA3UDR5bVBvcmNzTmlJS01EdktxRGlnM3dFUjRibXRTR1RNX3lrekEtMFNoNHZIOVdPM2FUQnRMNG1CVVlsZWd3LVpTRExYYXljRnhXaHBCTXc2dWpoczBnQkF5eHlxRFFiYVo5N1BCVjJZNGozRzRsTVF1aEI4ZmVXUU9WX2ZKN1ctb1ROZ1czVkhQai1lQ0dY0gGyAUFVX3lxTE4wZnplM3JSU0hTcVIwLUNORjNkVlFlRmdiYlZPN1diR21kd2hxQW9uM2JXMUN1QUdlWlVndXphQnF4c2c2YldmeEIydnM5TWRfMlA0LTFiam9VZU9WSjB4SjZxNk80U1pDaEVmYWVfemQyVnc2VEF2Xzh6aHZPUU9mM1dzbC1fUENObFhpTWtDYmctbGwwamVGTEpHM2Ywc29WN2g0RVBmbmRtUHlDRGptTnc?oc=5&hl=en-US&gl=US&ceid=US:en,suno.com.br,https://www.suno.com.br
PetroRio mira ações e dívida para comprar campos da Petrobras - Bloomberg Linea Brasil,PetroRio mira ações e dívida para comprar campos da Petrobras  Bloomberg Linea Brasil,"Mon, 08 Nov 2021 08:00:00 GMT",https://news.google.com/rss/articles/CBMiqwFBVV95cUxOTVkyZ3N1ZlRmWk1JZjdjY0NPSF83SzZwRGg5TVdmVXhPRlN6TEZNVW12Z2Y1U2ZqUnZLQUZrT0lZcnpxVmtUa3VyRk5KeGkyQUc3X3pYMEhqbEpTeDNxLVRjZXVfOXJkS1FWZGw2cjExMmR5OExwWFFPZE95MkhCTGxfc2ZYRzBpZ0ZTM2VjWHRxbzBiVU9adm52cFVLaDhPcklCM0NqUFZaYjDSAb8BQVVfeXFMTWtoNEM1bTlQU1J4amNLSE9mMDBNRm9QRDlibW5TOGZnX284MHF6dkJmZjVTVDNiUnRRbUFONXVJOXFhNldNQWRDLVIyRV91MzZtaE1QWElNZjRXaS1wa3A3YU0wUHE4b3pMVWZXcmlNd29fV2lQNXA0MjBNV0hPQmlOa0t2TW4tZmIwbThlV1JfNFJnR09YbWw0NDhkQnFUUl9PbkoxelNHdnBNTjFkTDlGTVg1LVY3V1RVYVhUbWs?oc=5&hl=en-US&gl=US&ceid=US:en,Bloomberg Linea Brasil,https://www.bloomberglinea.com.br
"PetroRio (PRIO3) dispara 17,8% com anúncio de negociação sobre campos de Albacora - Valor Investe","PetroRio (PRIO3) dispara 17,8% com anúncio de negociação sobre campos de Albacora  Valor Investe","Fri, 05 Nov 2021 07:00:00 GMT",https://news.google.com/rss/articles/CBMi4gFBVV95cUxOa1VIVW5SLTByNzc0RFplX2g3Y2ZRNVdRSHZ6OE1qcTZEd2NOS1BaRlBSNEFIYmI5dGlIVUktOGJSU2dUYjVUZlp3M3NIbGpmTmV1U3N2YmU1Sk1NLW9JZnlvZkp1U0RjNzFsSHl0ZGdaclFKWVFXb3NxSlJWRlhGSVFnTjdDZk1GcXdJQjlmVFU3NnhvNTFSV0Nlem8xTmlxZ0ZENUE2NWVOeE1OSXprTUZXaXcyVkpvU3JFZVlLVkpjVGRLeDMxUkp6Q0Y5ZWludlFRQnVPelZ5MXBfZmtUcW530gHwAUFVX3lxTE5fX0FIN2tBY3duSmRKOTNJQmVKSzhiTXd6TFJqckh1T3lOZHAzZ3FXMU9TQll5UmdrWmdrSDhFTktTZHhiR2x4NXBJWDRwN2g1Y2dtZUlzWk0zTzB1OGp5YTF4TmFWWGVoVGtWWTRESnk1UjZDUHlxX1pYQTFHMVU0NHdndDhXTWhLWDdhNUhFTGY1YlM2ZEZVY2p1Z2tHVlFGYlN3QVNNMWlOclh3SjE5M2k4b2dwbEt1RnFmLUdvVVVhZDRNX2ZfUkptLWdFQ2xZM1F4aGVrcThxVjdmMVNzLVNoRVMxem1xN0JwQjdhcQ?oc=5&hl=en-US&gl=US&ceid=US:en,Valor Investe,https://valorinveste.globo.com
Consórcios com PetroRio são escolhidos para negociações com Petrobras - InvestNews,Consórcios com PetroRio são escolhidos para negociações com Petrobras  InvestNews,"Fri, 05 Nov 2021 07:00:00 GMT",https://news.google.com/rss/articles/CBMiqAFBVV95cUxOSzVoZHNQVGhEM0RRQzJQbHVzeEV1OG1PdzI2WGxTSklndWI0SWlvVXZWQnF1UVR3OHNEOEhZMHNveERBZmN3ZXJycUU1QlZqY1F1QWFYRVplR05sejFHZG9KTGxzY2liRG12aEpkcnJJcmJ2cTVfNEVjV09ad0RDVV9kMnRpUkE3d2tHbFN6ZEZURkhDd1FIRi1vVF9Vb2JUY1FxT1lrX2zSAa4BQVVfeXFMUGlhTUpqdlBRWS10N0syV0ZRdkxiVGdKUlgzcG9JVDJ5b1BHcWtCSzV2dGxzNHJiNUYtRGpud2hVNFhTVWZ3YTVQLWdYMmlXMmx2Q2JUekVTRDBSUVc0d0R5VV9Xd2hyeFN2TVY3RTJ3OFlsRllrUm9kZnlJcUFUbzJrREM0VTZRdmMyU2ctMGhuaTZGbTd6LW9SZGR3U1JvTnlwNGVGM2IyRFFuNHRR?oc=5&hl=en-US&gl=US&ceid=US:en,InvestNews,https://investnews.com.br
BREAKING: PetroRio leva Albacora e Albacora Leste em negócio transformacional para a empresa - Brazil Journal,BREAKING: PetroRio leva Albacora e Albacora Leste em negócio transformacional para a empresa  Brazil Journal,"Fri, 05 Nov 2021 07:00:00 GMT",https://news.google.com/rss/articles/CBMirgFBVV95cUxPeTlWb1FURGsxVHNqVHJWTUpRc2hFRHcxUWZnb0NXRWJhcExMTHBjRnVTOXNsTElfYVJHZ29zcDNwaVpWWURhMllHRy10T1E4WUlyUlZ6aENrcHdmcGxSZElSYmE2SzA0em9ubFlrLWRxckZQZDkxYUNEMVF6QW1CcjQtNmVXRGI2cjZMbkdyV2N3RFZKazJJSFVSLW1OMGtXVU11dUFOZHhSVTVuTFE?oc=5&hl=en-US&gl=US&ceid=US:en,Brazil Journal,https://braziljournal.com
Maior petroleira privada do País tem espaço para valorização - oespecialista.com.br,Maior petroleira privada do País tem espaço para valorização  oespecialista.com.br,"Mon, 08 Nov 2021 08:00:00 GMT",https://news.google.com/rss/articles/CBMilAFBVV95cUxOVlJFTmpvQmQzY3drZTdJNDBfSWJRNlRjb1NMdTFlcXZDbmk1R0hwT3RkczdsZ25adTFYNmlwN1hWa3oxYWJZM0VCa2FUZWVET0k4OGtWUFAyUk1BcXNNS2RKNERYVWdOYVNOY043bk9YOEYtUW5uaUVfejBTVVRXa01KV3J1MTktMzBDRU5aQ0NmTHp6?oc=5&hl=en-US&gl=US&ceid=US:en,oespecialista.com.br,https://oespecialista.com.br
PetroRio na frente para levar Albacora e Albacora Leste - eixos,PetroRio na frente para levar Albacora e Albacora Leste  eixos,"Fri, 05 Nov 2021 07:00:00 GMT",https://news.google.com/rss/articles/CBMijwFBVV95cUxQM01jOU0yOHQtZEpjN1ZoNzcwQW1CLW5ndDREc3BGanBRTGNSMERoX2picFJTNXpNU3dBbDhoU1EwelFkSWszdjE4dWxBWHVodjRuYmpZbHZEM2dXTG12bEN6ZmlTSjVVSzExUUFXLWJnUm9ReXN6WWFoZHF6TnhtZU5mbm14MzB6aGRxUDBlNA?oc=5&hl=en-US&gl=US&ceid=US:en,eixos,https://eixos.com.br
Campeãs do Ibovespa: Veja as 10 ações que mais subiram em 2021 - suno.com.br,Campeãs do Ibovespa: Veja as 10 ações que mais subiram em 2021  suno.com.br,"Wed, 29 Dec 2021 08:00:00 GMT",https://news.google.com/rss/articles/CBMihAFBVV95cUxOTFZORkFILV9FWEJFRHA5dXFCcG1Wa2J3S3hUUXZSWmxhbUlOTUFMaTJSTl9SbEFIa3dSOEVCRTJBNkNSLXF1ZTVJUXRVWTh5Zk5GdmZpNmJvRE9VSWZDdWtDelZQQkNrUzBVbVhnSHBwY19IZmVBOEFjeGswMHZyQW1sTWjSAYoBQVVfeXFMTS0wTkF5WEVWVVBYV3RCTXNiTGdaY2hBb0ZxZ3E4Y1k1d0taQ3dwQkhHVmxkTElDVkdhQUVjTW1BNmxCSUk3dzJMUi1aLXFIZVVfTFI0ZVJzVUhYck1IbWdLOVp1N01Dd1dLa3FBQUtiTUhsaFJLaUxTc0JJR0c3eVkxZzViS0lvUFdB?oc=5&hl=en-US&gl=US&ceid=US:en,suno.com.br,https://www.suno.com.br
O que nos mostra o uso de royalties como incentivo à produção de petróleo - Exame,O que nos mostra o uso de royalties como incentivo à produção de petróleo  Exame,"Wed, 08 Dec 2021 08:00:00 GMT",https://news.google.com/rss/articles/CBMiogFBVV95cUxQell0Z2FncjNfT0RHVlZBYlBQTTd4Ti1BZERYS3dremdoSzJKa242U0VuT0ZEckJPUS1yVmdocGRGdXVDUEVPaEF2cVZwaEpFQVZhamlBc3ZMWDRmSWRGSzJETG80QUpMX1g3YXM3NkZlT1lUZDFHNTNoR0RjaDFTVTBKTVJyaGozU09vdlp3VmZlTnNqSG83OVJBS0U3Um03ZWfSAacBQVVfeXFMUE9TaV9kaTExYURLd3p0MDdhX0xsNnA4RkRGdEJnUGhCVExqSVd0c3g4V0FYNEF4OVB4Sm9iZTd4T09WaTBPT0RwQVlTUnhYZG9UYk5lWUJfeFlQSWQ1M1VhZTFLNUNwT0R0UnE5d3NvbTFZT1dDTk9uc1FEMk1jWkZWRmt4Rnhlc05LOWNFRnlyX3oySXhXeGt5ZmRxaGl6TFRVcDJSYjA?oc=5&hl=en-US&gl=US&ceid=US:en,Exame,https://exame.com
Levantamento mostra as ações que mais valorizaram ao longo de 2021; confira - CNN Brasil,Levantamento mostra as ações que mais valorizaram ao longo de 2021; confira  CNN Brasil,"Sat, 18 Dec 2021 08:00:00 GMT",https://news.google.com/rss/articles/CBMivwFBVV95cUxQYzhMZTlVdnlRODBpc0oxUC1xVkpvZ1MtcUYyTnNXSnZyNHpEZkhoWll3WEx3ZF9SUUxnRVFGSGd1bjFmZmtVWnFOR0I2ZFVYeFNkcldVQ1A3VG5YZnlFYzcycjVmVGFSQkg1SHNxTm03ellVMDRzYl95SFR3T0ZLZmNzMGdkSWwteUtobDhGd242VXZjNlhFR2FsVU8xdldXazdvREgwbkhTdUlFN1VDdTVOckdOcUtTcU1FN0R5WQ?oc=5&hl=en-US&gl=US&ceid=US:en,CNN Brasil,https://www.cnnbrasil.com.br
As 10 ações com os maiores betas do Ibovespa nos últimos 5 anos - Money Times,As 10 ações com os maiores betas do Ibovespa nos últimos 5 anos  Money Times,"Wed, 08 Dec 2021 08:00:00 GMT",https://news.google.com/rss/articles/CBMimgFBVV95cUxQTFNLN3lFLTBPb0E4WnhiSjZQNHY5a0lyZ1Q3QVJDX1l3b1JQNmhFZ1JicjVSUGQ2V3dTR1k5MkVpT1NOSEZ5aGNjTzY0WGlKblhUYTBMYUNDTDRDNHFfSmF2eUF4SHcyVzl5em9rZHltVWJDNkpadUgyd2JjMlBKN3RwRkZoQXE1Zm9Edl9KQXpocVIxQWJOUlhB0gGfAUFVX3lxTE0yWlFndVZhakhlMnhndm5yMFlMWFlGWU9GQ05fUWdfeWxBRFBET2lnRC1RLUN6X3BWLU8xWkYyUDhSNmdHWDNJNS1tTV85NTlGdmduR2tLT1gyd2VfWEIxRlY1RXJHV3lLLXZnTVkyVjJDUlViRjJPRG5tRU95VVd5VXl4SUJJNzY0dVlwRkRkQ3U2aGtGQ3pMMXlCUVJJMA?oc=5&hl=en-US&gl=US&ceid=US:en,Money Times,https://www.moneytimes.com.br
Suzana Pires e Virginia Cavendish assistem a PorscheCup em camarote exclusivo - Jornal de Brasília,Suzana Pires e Virginia Cavendish assistem a PorscheCup em camarote exclusivo  Jornal de Brasília,"Tue, 07 Dec 2021 08:00:00 GMT",https://news.google.com/rss/articles/CBMi2gFBVV95cUxPZVlQZi1jNUk3RFloYVlrOG1DdlhxamRfal9Cc0dhb25SSXhGM1FXLVNIcWxpNlNYbW85eHZTLUxMQXRNOEdMUkJhMHVJVWlWVGRMeHZUcGQzRzgyTlpyMUh0bXdLTWczVXpsRWRfOXJBaXpJeTJ6RUJpZkNnc2ZUc0pwQkE0MERqY1JVMkpnTWprQWlydTMyVTFDQjRyc3dkUC1Qbjh6eWhRR1IzU25BNTI1ZUlHNmxud0hnalNzV1FIUUxpTFEyWi1wbnMyMXZtX19SazYxbmdidw?oc=5&hl=en-US&gl=US&ceid=US:en,Jornal de Brasília,https://jornaldebrasilia.com.br
"PETROBRÁS RETOMA A PRODUÇÃO DO CAMPO DE MANATI, NA BAHIA - Petronotícias","PETROBRÁS RETOMA A PRODUÇÃO DO CAMPO DE MANATI, NA BAHIA  Petronotícias","Sat, 18 Dec 2021 08:00:00 GMT",https://news.google.com/rss/articles/CBMijgFBVV95cUxONmpoRXhITzVhbG9TT1BqQnRCZnI2SzdEMENPbXB0ekNrV3NXMkpWOTdtNGh5UE9xRXhzX0NVaW9xME40VnBOTFBlUlhsU1IyZm82UmlLZ1o4dEZpeFFuN2ppWE9HcVhsTTNDc2RkcFdDZFhRTHUwOGFHbGNQa2d6UkxWS1ZUNVVVeGZaUWZn?oc=5&hl=en-US&gl=US&ceid=US:en,Petronotícias,https://petronoticias.com.br
Desktop conclui compra de 100% da rival LPNet Telecomunicações por 340 milhões - ADVFN,Desktop conclui compra de 100% da rival LPNet Telecomunicações por 340 milhões  ADVFN,"Thu, 02 Dec 2021 08:00:00 GMT",https://news.google.com/rss/articles/CBMiswFBVV95cUxPa2ROYWRSWTF0MHBXUWoxX3J6eHRpSmlENnBLZTRlS0k0SC1aSWxQMTBVTlFrR3FJNXZ6QTQ2U3N1VUlhVVAyN0tzX1k1OTZtVk1ZdU1ySzlyRXM1d3lLMlUwWjN4WGlZR2VacExyOEpKQVN4MjFaMzE2RmtfMVhaVHBCcHc4LS0zQXZMZTlhM3Niam5fY1FzZC1yN3NsNGNKQUNwc1VBSElSd0dYZnVYTUJRZw?oc=5&hl=en-US&gl=US&ceid=US:en,ADVFN,https://br.advfn.com
Veja as 10 melhores e piores ações do Ibovespa em 2021 | InvestNews - InvestNews,Veja as 10 melhores e piores ações do Ibovespa em 2021 | InvestNews  InvestNews,"Thu, 30 Dec 2021 08:00:00 GMT",https://news.google.com/rss/articles/CBMilAFBVV95cUxPeFVEYnQyTVFUbWZHZ2plUnhaUXBXQWx2VTRiYnlOWjIyNnRmOTFmU3lkZGMwcVB4R1pFODZJVUNyblBPM283Wkgxdlk1ZFYySWZCVGpTZ25CMU15WXBEeWtEdnpjSmJKR1UzMEJTTWNHRXFEVEtCSDFEY3REYzdmbWZPUEl3Tk4tOGpqZzFyR3gtNTNf0gGaAUFVX3lxTE91WlpOeXkzM0tfcGtjXy1Ib1lrR3ZEOEdNNGZhQWF0ZThVX19XVzIzdWF3QTE5XzBKUWdRM0U2NXlfd2NHZTVlSDdCN1Q1dlRKR1FGQXgxamNZblpLa1Y1NXg4TW5fMUYwRXBFRWd0RU5pN1dLUXBpMmlqeEdELVJPNmdKdEM5LWJ0Z1k4R2I0LUd5Vi1lS3J0bWc?oc=5&hl=en-US&gl=US&ceid=US:en,InvestNews,https://investnews.com.br
"São João da Barra, Macaé e Campos lideram investimentos confirmados para a região nos próximos 3 anos - Clique Diário","São João da Barra, Macaé e Campos lideram investimentos confirmados para a região nos próximos 3 anos  Clique Diário","Fri, 17 Dec 2021 08:00:00 GMT",https://news.google.com/rss/articles/CBMi0wFBVV95cUxPakx3SU1uSGZERnhCSjVYUml3Wmhpbmg3WU8xQ2J5aUpkTDUtQjhQWkdMY09kUEZKNTRfT0R6VFFHcGg1T1dIZUkxSUxNWVhyRmNpWVlxU2hJRGVBQjhlY2pmeTM1V2hJNHVrb1BwU2RRVzM0aWNZRUpVVVI1N0s1LXJOTFhhWHFqMk8yRl81TS1GZlYtYXZWRmZCbkhsWWhXWVloSXQ4Skg1SlcyT25abUR3eG5HVGpIZnRveFVFTGxJNUt4WHhEQlZIRnFDMnpwdE0w0gHYAUFVX3lxTE9JS1Y1d09RQkdVa3JJVHRaU1lfQURMbWtPcU50Q21idHBtUjVFVTRwVElNdVdCbnA1akU2cTRrMjhYWVBuRHdSUk4wWU1pc0d2WVlJOVd6ZU8zMzJNUk8yWDhSMVZEVkhJZmlvLU9ZZkF6ZzN4RzNrcVJIejh6NzZWT2dwQW94eHlXdFlZZTF2a2I3TllreTlRUzkyTVpLd3hlYTBzMGJ6TnRhUlBESElHM05weVhQMGhXeko5T1NWZ1U1bzdNRHhNNXE5S1lYYXNwX3lra29qUQ?oc=5&hl=en-US&gl=US&ceid=US:en,Clique Diário,https://cliquediario.com.br
"Acionistas da Alliar (AALR3) batem o martelo e Nelson Tanure assume o controle da companhia, aponta jornal - Seu Dinheiro","Acionistas da Alliar (AALR3) batem o martelo e Nelson Tanure assume o controle da companhia, aponta jornal  Seu Dinheiro","Tue, 21 Dec 2021 08:00:00 GMT",https://news.google.com/rss/articles/CBMi3wFBVV95cUxOWmJQaW5ybFZEUy1jZmdZRGQtckV3TXJiTHZDX21mU08wRzdJbmVzNHNNTTl1MTgyT1ZMTW9LMlJnX0lYUTBqQ1JWdjFKb1pFX1BoS01IcGZpMXVvd29Rc1VWVVJ6aFlJVDE3cVB5c1Nxajk0OVhGbkVtYW85ZkZKZ09vUXFfaDktUk5lcVJsbVFXcWlQdTAwSG5FUjhPVjVoMnAxSWdBUUlEMENQODNzQnA0cFBiVEhIQXhrY04wY3NUS0JLaTF2WjAxa3lwWGpVd2tzRnpYZExOY19wZVRN?oc=5&hl=en-US&gl=US&ceid=US:en,Seu Dinheiro,https://www.seudinheiro.com
Multinacional RIP Serviços Industriais abriu vagas offshore em estado de urgência para Campo dos Goytacazes - Petrosolgas,Multinacional RIP Serviços Industriais abriu vagas offshore em estado de urgência para Campo dos Goytacazes  Petrosolgas,"Fri, 10 Dec 2021 08:00:00 GMT",https://news.google.com/rss/articles/CBMinwFBVV95cUxPZGdqWm5jeXdIajdGT05rOENtSkkxYXhlR0JWNjFqUzQteE8tN2cxb2N2dm50QUcxRTIyRlN2eWllWDBaMmRKTmctOUJ1VnNkSThFZF9BT2NESFl5LXBtUkdTQWFUS2N4dmxTY0htNE5WWDFiSU1kM3VKS09rY3MyRF9BUlA4bWl4S2MxOGpVSWlwQVBfUDJXRmx4Qk1PaWc?oc=5&hl=en-US&gl=US&ceid=US:en,Petrosolgas,https://petrosolgas.com.br
"Credit vê petróleo mais caro, eleva preço-alvo de PetroRio (PRIO3) e projeta dividendo de US$ 18 bi para Petrobras (PETR4) em 2022 - InfoMoney","Credit vê petróleo mais caro, eleva preço-alvo de PetroRio (PRIO3) e projeta dividendo de US$ 18 bi para Petrobras (PETR4) em 2022  InfoMoney","Thu, 06 Jan 2022 08:00:00 GMT",https://news.google.com/rss/articles/CBMi9gFBVV95cUxNV19CZkhBc2xFUjVKMnY4UEl4VGN2Y1VmZEwtdHN1RlJ3XzBFWlFwRFl6YjNWWlNFeC1ScjhLQ1BsV0J5S3gxdGxQanh2ZXBrU0I1Z2FLVVZzOFZ5c2hheDI2S3Q4VkpsSFd1VmswQWplRE4xcE1YUFhXTHo4RUlqOEtLcWhDaGhYUW9vamtWN3daVElNdGJpdXA0OEdHN2ViWVdDaVVEVzNmbkZmRzNXbG1WTzZZMjdjNHdMNUF2Z0x5Ri1jcmRlSy1qRTVfWE9rdUtkRWZja3VRSmlZXzlPR3RkXzRCWWdJSE9ncldfWTZqRDV5dGfSAfsBQVVfeXFMTlhxd01ncm4xZG5aMHY2RENrUTlBN2VTTmN5TGpjQjA0NGtuMEhDVTRtck9uRTdoYXExeVgyWDVvU1g0MXhoZ3ZuRjFuY3dRcHU0RERSdEV3UjdTanZfSzRyZ014RU9BSG0tSGlLb3V4aURfS1JFS04zQU84Q2VDWlV1UjhKcUEzT3NZTHFDOWlyMW5HVmhsZEVfUzZqczlMWl9nS2RBMXpDNmVkcjB3TmJtN0c5SVZ5RFRZeUJ0c3pwMVEyWWVKaHhXU3NzMWJzNlZwQ09sdHp6NFFCVmdwN2tIM3lCdnNXZ1hFYjNDUlFJOFlxMi1lbTg4bGs?oc=5&hl=en-US&gl=US&ceid=US:en,InfoMoney,https://www.infomoney.com.br
"Denúncia: PETRORIO negligencia gestão de equipamentos, gera acidente e omite informações - Sindipetro RJ -","Denúncia: PETRORIO negligencia gestão de equipamentos, gera acidente e omite informações  Sindipetro RJ -","Mon, 17 Jan 2022 08:00:00 GMT",https://news.google.com/rss/articles/CBMiV0FVX3lxTE81UjlsQWRFejZQYnhUb3J3Z3F1anYwd3VvSXFlQ2tVOTJDYzBKYjhLTWsyOE5pTVNoRTZ2LWZaTG5DbXFrQVZwejNSbE9NQzhHT1ZtN0g3dw?oc=5&hl=en-US&gl=US&ceid=US:en,Sindipetro RJ -,https://sindipetro.org.br
PetroRio (PRIO3) entrará com recurso após nova decisão do TJRJ no Campo de Wahoo - suno.com.br,PetroRio (PRIO3) entrará com recurso após nova decisão do TJRJ no Campo de Wahoo  suno.com.br,"Mon, 24 Jan 2022 08:00:00 GMT",https://news.google.com/rss/articles/CBMif0FVX3lxTE5IX21qZVp4R1FiYVd3cE5FeTBuOU1KZlI1bVkxY2RFLW5yZUJkRDVyNl9DYll2SE5EYXc1RmRnWkNBUC1leklDblhvRkNQRVgzak00aXpZZkxXUG05bTd0QXZLM2U4TnRZMzE5TkJ5a0liOUZsbURCcWdwcFpadXfSAYQBQVVfeXFMTU9YaG5KX05MWkl2UGFzWEMxbm9WRXBnU0xkeUtvNTRIanh3aTkxd1BaLWlvUTU5NkxUUnVlcUpoZEVKNVM1cXRrU0I4U09FY1VCWk9Ydlc2VnlrNk1lY0twQzhUOFZGWTRtSHNGTW1hajk3amdmZWVrMGZ5Qld0UXBOMlBS?oc=5&hl=en-US&gl=US&ceid=US:en,suno.com.br,https://www.suno.com.br
PETRORIO VAI RECORRER DE DECISÃO JUDICIAL QUE IMPEDIU DECLARAÇÃO DE COMERCIALIDADE DE WAHOO - Petronotícias,PETRORIO VAI RECORRER DE DECISÃO JUDICIAL QUE IMPEDIU DECLARAÇÃO DE COMERCIALIDADE DE WAHOO  Petronotícias,"Mon, 24 Jan 2022 08:00:00 GMT",https://news.google.com/rss/articles/CBMivgFBVV95cUxQMXQ5ZUM2S29NT1hIbGlyNlRKdEpESDYxZ1BlTko0QlBha0hYSHYxV2lnNktyY2J1Q3h4VXhsaGVnN0RSdERpOXlwNlAzdTdMZjBwZF9aUjRPWU1VOXFpZlBSSk5TTTJpZ2RINHBFTXB2TzFnRW4tOU9GNjBVd1NCOVFHTHh1d1dhYktXXy1PMWQ4NFctWm9RV2xGTDhNZzZjMFVYQngyYi1EN0pYVUNvU2lxaUVOT29xOElDeUhR?oc=5&hl=en-US&gl=US&ceid=US:en,Petronotícias,https://petronoticias.com.br
PetroRio (PRIO3) informa que decisão judicial impede desenvolvimento do bloco de Wahoo; empresa vai recorrer - InfoMoney,PetroRio (PRIO3) informa que decisão judicial impede desenvolvimento do bloco de Wahoo; empresa vai recorrer  InfoMoney,"Mon, 24 Jan 2022 08:00:00 GMT",https://news.google.com/rss/articles/CBMi3AFBVV95cUxPQ2NGWE5uRUh3amhJSHJPTjd1VWEtdmJ5Mld5Qi10WFFEQ0ladVRaLV9WRGtscGpFODRseDNxd3N4cGotMXFUOHpVV0h0VlhSRnRVVEJ4d2JsamJjQ3FVbFFLYzBxR2FXVGRvU0pWZTkxN1RzdXh6SExqN1R0QzBKNlh2Z3puSVY0SjJsZ2luVExhS3Z1c3Nqc2ExMHJGVEctdWRjbkhVUXBPZWI1QmhTYzhDdXNWZWoxdnZWd0Z6U3JVdW1nM0ZHVy1TQ3dkYUxrRmZXZEpiUGtqTmlx0gHiAUFVX3lxTE8yTk5WOXp1X0ZTN041aXh5aldmZUQ3M04tb1lsUmVadEcxNzczb1FfaEZ5YVhVVEYzQTlhUE5zMGtGRWN2ZzlDckd6TmlhdlYwQnowZHpqdmp6ci1UQVF1RDRDcHViQW5pal9tRDAzekhBUmwwX0dzSEh0MXFGMTdRYTZlMVJXdHF3aHNjNW4zX1lPWlJINnVlWjh5R2FrYlV1VnRVMDF4UXA1Q2NxcmNFV0NmOVNYeTBwNGZ1ZldhbjVpb0NwdmlvaDBPdHg4ZlNkazdINDRIeWhUODcyT3NBaEE?oc=5&hl=en-US&gl=US&ceid=US:en,InfoMoney,https://www.infomoney.com.br
Gas Bridge e Enauta podem implantar projeto de estocagem de gás em Manati - eixos,Gas Bridge e Enauta podem implantar projeto de estocagem de gás em Manati  eixos,"Mon, 03 Jan 2022 08:00:00 GMT",https://news.google.com/rss/articles/CBMivwFBVV95cUxOcG44VGZ6NU9jTUhLSHJ6ZVpBSVNoSERiVWpkU3VEczdobl9ETTZOd2UyTUt1VXdfcnJDSV9PQ2ozT0V6aHRKM1dXcnBYMVBwVzB3TDlpWDktdlNhRWx6UnNPMGVsZnFGM3Y0VWt5TGZPU05xdkp1SlJTb1NYRkx6bkJHWnNXU0RPY29mWWRyMGlTZmwxSGswYmh6ZGMwV1cyX2JTbUdnMEtBWktBMnhLVjNqLVNCVFRLY05uSE5lNA?oc=5&hl=en-US&gl=US&ceid=US:en,eixos,https://eixos.com.br
Órama adiciona JBS (JBSS3) e PetroRio (PRIO3) em carteira semanal de ações recomendadas - SpaceMoney,Órama adiciona JBS (JBSS3) e PetroRio (PRIO3) em carteira semanal de ações recomendadas  SpaceMoney,"Mon, 17 Jan 2022 08:00:00 GMT",https://news.google.com/rss/articles/CBMipwFBVV95cUxPaXR4WFJoSmVhREFXd0p0YUNsUDBjc2JIZ003c2lKTFg5SlNZQWRrTlp4cTlLRW5YcXl4UU0xaHg3aFROSEo1UlBkYUllVXJXYUZYR0NvbXRCUk5SR1d3YTBOQ1NrQVFPZXU3Wm9PSW5UeG5NUWI1VmpaQ3dfODhwclRZZERob2xnRkF0bDkyZVE2emhfMmhSMHlIb2tDc2NCRjRyQkIzWQ?oc=5&hl=en-US&gl=US&ceid=US:en,SpaceMoney,https://www.spacemoney.com.br
As empresas da bolsa com mais caixa do que dívidas | InvestNews - InvestNews,As empresas da bolsa com mais caixa do que dívidas | InvestNews  InvestNews,"Thu, 13 Jan 2022 08:00:00 GMT",https://news.google.com/rss/articles/CBMijwFBVV95cUxQcEQyaUZBQ1Z1dE5DTENKWFIyOXBMWFhpa3NDX25Ddlh0ZnVJSjJic01VaXhWa0M3OG02dC1pNDE2TWhKNW83aEphMFREblNQUVkxeXJ5cmJXeHU4SHZwRVVfQmtPSWxSUjF6dTdGem1jOVdocEJFRjVEWG9vWDE3NW9CVGFzcUVabkc1R0Jac9IBlAFBVV95cUxNeVgzUEdER0d6dUVUdG5yWnoxNF91T2E0d1FRN2JCM21jaU12RjJwc1JGU1NNaUJtSm9ZMEhTa2dyclprWTY4RW5pd0RnYzlkZEhQa2R5Q2I0Y3U0R2hQWXZ0TWNDaHo3VnpfbU44OGJxbkxKZFVDX2w3dEFGSXVYY2pHYjdCaTJFVzR0T0V3a1A5VURv?oc=5&hl=en-US&gl=US&ceid=US:en,InvestNews,https://investnews.com.br
ENAUTA FICARÁ COM PARTICIPAÇÃO EM MANATI E ESTUDA PROJETO DE ESTOCAGEM DE GÁS NO CAMPO - Petronotícias,ENAUTA FICARÁ COM PARTICIPAÇÃO EM MANATI E ESTUDA PROJETO DE ESTOCAGEM DE GÁS NO CAMPO  Petronotícias,"Mon, 03 Jan 2022 08:00:00 GMT",https://news.google.com/rss/articles/CBMitwFBVV95cUxQeE1uTUljd05QMDlCLWtzV2FhNWtQTXpGVHVuM2pzeEp3WHE5aklEUkJCcHAtMmcxRGFlWTNjX01PdW5HTW5XMWJ2RENVNllyR1lzcVFWLW1WdmFXMEVXTlhJSWF2VU1oOC1OMnVDWU02a2VVaDZkdHJRQjZlcjFwZFlfWjVlM3N5RUx6Y2J1a0JtenRUdTFxaURONEdyVGU0NThfM3c1cXc2UGxWX29mNHo1eGp3RjQ?oc=5&hl=en-US&gl=US&ceid=US:en,Petronotícias,https://petronoticias.com.br
Ibovespa resiste à pressão do exterior e fecha em leve alta; juros DI voltam a subir com temor de inflação - InfoMoney,Ibovespa resiste à pressão do exterior e fecha em leve alta; juros DI voltam a subir com temor de inflação  InfoMoney,"Tue, 18 Jan 2022 08:00:00 GMT",https://news.google.com/rss/articles/CBMi3AFBVV95cUxPOF9XakdSTm5hM2plZDhzZmlLa2tETFhVaE5WeDVFWXNiRkVYOEEyVnNoOXQ4bWt2T1hhSjZRLUk1eFRHZUg5Y1hSYjJtLWJDUmFZSlpzNXI4YUZ3TEtYeVpyMVFfdWs3Yko0dGpTQmxHNHJ3VmNDc3dJOV9UX2xleHFUc0dUeno4c2xjVEV2OE4xWlQ5OV9sY1NEaTd3M2k2OFF1UEF6LWdWMVJGa3hDd1JER0thUDJSUHduSXEzUnNWOHBmalMyQWFYZGs5dTZfNEpGMXpDYkFxMFIx0gHiAUFVX3lxTFA0U3dwYlhXNEE2Q2dCU2VMQkdWLTdKbzI1bkhWdUFCZ2xUVG03ZHBtZkxBRzBVN09NTWo2VzBTeHBLdnFIMTUzOFJscTRkUnhrUHhlTDdLeTlSTFlTSW1IUzJ6ZUxZdzdoNVFWUkFrTzZxMkxabFFBWktKd0tSenZEaWp3REV4dms3ZWE0ZU5VUFFEWEdRc1Z2SmVDSVpwRElnOTJQS0dyRlk5bVluOGlRc3RSbVRMT1RjNlhORVRJUzNSMzRRU1JzV0I4VVZtYUdjMjBYS3hNTEhsQVZNU256V0E?oc=5&hl=en-US&gl=US&ceid=US:en,InfoMoney,https://www.infomoney.com.br
As 5 maiores altas e as 5 maiores baixas do Ibovespa no mês de janeiro - InfoMoney,As 5 maiores altas e as 5 maiores baixas do Ibovespa no mês de janeiro  InfoMoney,"Mon, 31 Jan 2022 08:00:00 GMT",https://news.google.com/rss/articles/CBMixAFBVV95cUxPNDU2MXY2di13UFowcVkwOTFqMDhvdFF2X19FbGVVVVlnRGg5dWViWFJ1cU0taXBEQmd4eVRMSEwwWkQtV25Gem9sR0RvUjZ6bE83Q19TdEE4bW1CR0prNTJibEp0SXUzTjFIczR0QWVMUEJjTEZ4amt6WDB1NmlVRG80aUtUQVlNa3pIcFlxdTVlc3gyQUxGWWNKam1vTFRyVkhkTVhUbzN4ZHFRSDlvZkdMeWQ1dC1LYlhRYVo3RXdWYi1s0gHKAUFVX3lxTE1wdjY0MGhEazRROGVTdk8wX0swbXdfTkswRTJsdVA3VlNNSnFjOUw4Q2pKTGFSV19HdEVScHdZQ2w0alB2R2FPbjQ5bGItQjJBY2x6QXAtUi0tSWk0Q0ZtRW5ETHRzbVBtWW9CeHA0ejVBa1ZCMkMyLThvVUNERDJrTTQ3d215aEJaMXhpaXhyUExKWkpmM1Fhb3pQeFROa285Mkx4UjNrS05helE1QmtYczRNbFB6M1VPbUNncTNNUng5VnpPa2NiTHc?oc=5&hl=en-US&gl=US&ceid=US:en,InfoMoney,https://www.infomoney.com.br
Como a PetroRio (PRIO3) conseguiu chegar ao menor custo de extração da sua história - trademap.com.br,Como a PetroRio (PRIO3) conseguiu chegar ao menor custo de extração da sua história  trademap.com.br,"Wed, 16 Feb 2022 08:00:00 GMT",https://news.google.com/rss/articles/CBMivwFBVV95cUxOVHJiYjZ3NGt6RGZGamZ2c0lnZ1hRb1RKVjJORDgweFpwUzRlMDAwbDVNazZnSmpKcy1OQmpQdVhvaTBQZzA4Z1YzSlp2ZUxKQWV3bjR4UTV4TEFfNDBId0hSa1dHS2RJUkQwU1ZwTHgzOWRjVnhRVmNnSDQ3M2VXNkN3NmVmenV5WHk2c1FsZDdMSWdEX0l3am9tQTJoRE5CSWJiUjlWVGE1cW95eFN4ZzJlTUt5UHhDWk1ad1U3Yw?oc=5&hl=en-US&gl=US&ceid=US:en,trademap.com.br,https://trademap.com.br
PetroRio tem lucro 89% maior no trimestre e tende a se valorizar - oespecialista.com.br,PetroRio tem lucro 89% maior no trimestre e tende a se valorizar  oespecialista.com.br,"Wed, 16 Feb 2022 08:00:00 GMT",https://news.google.com/rss/articles/CBMia0FVX3lxTE83Rm9hY3M1S1o0dDNENzMwR3BXVk1xd2FYYVEtS0dqa2FJME1qSEFkQW5FNDFBN291aF9IYS0ydE1majFDcUtOOGtsOFY4NVRnN0pkYktGazhzNTBUWDRDSTlwVTlnMlhVb1dv?oc=5&hl=en-US&gl=US&ceid=US:en,oespecialista.com.br,https://oespecialista.com.br
"Sonda King Maker, operada pela PetroRio, a maior companhia privada de óleo e gás do Brasil, conclui em tempo recorde intervenção de poços na Bacia de Campos - CPG Click Petróleo e Gás","Sonda King Maker, operada pela PetroRio, a maior companhia privada de óleo e gás do Brasil, conclui em tempo recorde intervenção de poços na Bacia de Campos  CPG Click Petróleo e Gás","Wed, 16 Feb 2022 08:00:00 GMT",https://news.google.com/rss/articles/CBMilgJBVV95cUxOMUlIbm51c2Y3Yk5yWjRhQ1FwcDdmTkZtdGFoUlVhZFdvVzgxaThNQUhpVjlDOF9JOFdwSXhOcG9xeTNjUWtCQTkzTHRDaWFaQVFnTWRwSmJmblhvQk9wMjNvaURBQzdzMURPZ0FmQl9NUFl6OUc3RU5iZFFDWmduODU3Mkd3bk9nbS1qR1hGWVFZSTRKcEVldHZCOXIzeGVmbXpXbHNOa1lIcGp2WG82NUJIMmc4N25TRUh5TkstVFRRa2IxQ3JWcHptb2s4VlZTWjY1SWxjYlZ1Y1ZfN0E3RGtvZm5GcnBaWVp3R29WSTF4VjFnV1h5WVdKS254NzJwWjNqUkh6aGk1bVZVa0xkNXVuckdPZw?oc=5&hl=en-US&gl=US&ceid=US:en,CPG Click Petróleo e Gás,https://clickpetroleoegas.com.br
PETRORIO PREPARA CAMPANHA DE PERFURAÇÃO PARA MARÇO NO CAMPO DE FRADE - Petronotícias,PETRORIO PREPARA CAMPANHA DE PERFURAÇÃO PARA MARÇO NO CAMPO DE FRADE  Petronotícias,"Thu, 17 Feb 2022 08:00:00 GMT",https://news.google.com/rss/articles/CBMinwFBVV95cUxNZWQxSFA0ZHV2dTFkNnc4SWtQbFpLNVpxSWFvX3JXX0RMd0dQanpTZk9uekxvRFMxUkJMVTZuVjVSMlBHbE9QSU9NOHRJa0dLU3ViYTJwY3lGRDhTeUViNk12RDFvNHB4VEhQUmdtX3dMbF9ja1VkNmlWNG5tNG51S2toUWtncHh2WHhHcGJDcHBJS0VlX2RVejR2cHZLMUk?oc=5&hl=en-US&gl=US&ceid=US:en,Petronotícias,https://petronoticias.com.br
